video_url,title,caption
https://www.youtube.com/watch?v=cFmXFXVRq4s,[ 우울증 증상 ] 우울증약 부작용 후기 효과 약물치료 알려드려요,라 정신건강 매거진입니다 오늘은 우울증의 약물 치료에 대해서 저희가 얘기해보자 하는데요 어 스 샘들 우울증 꼭 약을 먹어야 되나요 거의 제 목 그런 말씀들 많이 하셨잖아요 우울증이 뭐 마음의 감기 가 뭐 그러면 감기면 야 안먹어도 되겠네 뭐 우울증은 실제로 정말로 심각해지면 우울증이 감기 정도가니라 꼭 이 항생제 치료가 필요한 폐렴 수준이 될 수 있으니 그런 경우에는 뭐 약한 경우 난 드시지만 그런 경우는 약물치료로 하시자 고 설명을 드리긴 합니다 환자분들이 제일 많이 하시는 말씀 중에 우울증을 약에 의존해서 치료하면 안되고 의지로 이겨 내야 되는거닌가요 그런 얘기를 진짜 많이 하시거든요 그 개념이 왜 생겼냐 하면 이게 5 우울증이 질병 이다 라는 생각이 잡혀있지 않기 때문에 뭔가 우울증은 우리의 의지에 문제 생각에 문제 참격 마음 심 의 문제라고 생각을 자꾸 하다보니까 우리가 뭐 성격 무심 니 마음 생각을 뭐야 부르고 치지 않잖아요 우울증도 우리가 이겨 내야지 약으로 치료해야 되는 그런 질병이라 생각을 잘 못하시는 것 같아요 그런데 사실은 우울증은 이기연 해야 되는게니라 치료 받아야 되는 질병 에 달하는 것 설명을 드립니다 예를 들어서 우리가 당뇨에 걸렸어요 그러면 당뇨에 걸린 환자한테 의지로 이전 해라 약이 의존하지 마라 이렇게 얘기 안 하잖아요 질병 이라는 개념이 부족하기 때문에 그렇게 설명하게 되는 것 같습니다 그런데 이런 잘못된 생각들을 하고 계시는 분들이 워낙 많아서 이제 그런 말 하나 할 환자분들이 많이 상처를 도 받으신 것 같아요 근데 이제 명백하게 우울증은 외 병 그리고 질병이기 때문에 그렇게 되는 꼭 제대로 치료를 맞는 것도 필요하죠 쉽게 말해서 저는 환자 분들 한테 뇌의 호르몬 같은 것들이 있는데 풍성하고 그 다음에 균형을 서로 잘 이루고 있고 이러면 문제가 안생깁니다 뇌에 있는 그 호르몬이 왔다갔다 하는 호르몬들이 부족하던 지 않으면 붉은 용을 이룬 다든지 이러면 우울증이라는 질병 상태가 되는 것이다 이렇게 설명합니다 예를 들어서 쉽게 제가 자동차로 비율을 해드려요 자동차에 기름을 넣고 지 잘 알 수 있잖아요 근데 기름이 완전에 이제 바닥을 보이면 갑자기 차가 다 서 버 리 잖 요 이게 이제 바로 우울증 상태가 비스타 나서 그렇게 비율을 해드려요 그래서 우리가 품성 해야되고니 있어야 되는 신경이 호르몬들이 쪽쪽쪽 바닥을 보이게 된 상태가 되는 거예요 신경 얼음 원을 가득 채워서 건강한 상태를 만드는게 바로 치료에 제일 중요한 원칙이다 이렇게 설명을 드립니다 질문 주의 요런건 처럼 많이 말씀드렸습니다 그님 그 내고 약을 먹는다고 제가 생각이 달라지지는 않잖아요 라고 하면 꼭 그럴수록 했는데요 제가 몸이 안좋고 힘들어 주고 우울증 상태는 뭐든지 사고하는 방식 의 부정 쪽으로 가기 쉽습니다 절망적이고 비관적으로 가기 쉬운데 컨디션이 좋아지고 회복이 되기 시작하면서 이게니었을 수도 있구나 다를 수도 있고 낮고 긍정적인 방향으로 가는게니더라도 생각의 방향이 조금 달라질 수 있으면 그것만으로도 회복에 큰 이익의 지침이 기도하고 그런 어떤 지표 이기도 하거든요 그러니까 약을 드셔서 많이 컨디션이 오히려 먼저 좋아하겠다 면 오오미 괜찮진 다음에 마음과 생각이 주어질 수도 있는 겁니다 그럼 약을 먹기 시작하면 바로 좋아지는 야 그런 것도 질문을 하세요 호 약을 먹었는데 일주일 내내 먹었는데 효과가 없어서 그냥 약을 끊었다 이렇게 얘기 하시거든요 그래서 어느 초반에 환자 분들 한테 다 상세하게 설명을 해 드리는게 기름이 완전히 바닥에 떤 게 가득 차는데 굉장히 천천히 자요 보통 이제 이론적으로 1 2 3개월 정도 걸린다고 생각하시면 되요 즉 증세가 굉장히 심했던 우울증 상태가 거의 다 낫는다 그게 2 3개월 걸립니다 그래서 보통 한 2주일 정도는 거의무런 증세 변화가 없는게 도리어 정상 이고요 초기 안착 2주 정도는 부작용이 없는지 즉 약을 먹고 나서 도리어 더 나빠진 증세가 없는 지만 체크하시면 됩니다 그리고 이제 이슈 가재 나기 시작하면 서서히 증세가 좀 좋아진다고 느껴요 그리고 한 한달쯤 지나면 은 보통 증세가 상당히 좋줘 예를 들어서 1 100 만큼 힘들었으면 한 달 정도 지나 10050 정도로 학교 좋아진다고 느끼고 요 두세 달 재 남의 환자분들이 무슨 센터 이제 다 나았어요 너무 좋아졌어요 그러니까 끊어도 되나요 또 이렇게 많이 물어보십니다 그러면 이제 제가 또 자동차로 비율을 해드릴께요 가득 찼던 기름이 이제 이 3개월만에 약을 다시 끊게 되면 다시 쭉 내려가는 경우가 되게 잤습니다 그래서 이제 보통 어떻게 권유로 하냐면 이거를 올라간 상태로 최소한 6개월 정도 약물 유지를 하면 보통 재발 없이 뭐한 5년에서 10년 정도 재발 없이 잘 유지가 된다고 그렇게 되어 있어요 그래서 보통 짧게 먹는 분들은 제가 보면 8개월 정도 먹고 길게 먹음 한 1년 6개월 정도 먹고 이런지 우울증 일반적인 그냥 주유 올 병을 기준으로 하는 겁니다 그렇게 해서 길게 먹어 만 1년 6개월 정도 먹고 약을 끊으면 약 없이 완치 돼서 이렇게 잘 지낸다고 이렇게 설명하고 어떤 드립니다 다음으로 또 많이 하는 질문이 의존성 중독성 내성 습관성 생기지 않나요 그거 제일 많이 불어 보세요 1 전기가 집중적으로 치료를 받은 다음에 약을 줄여서 끝내면 이제 제발 없이 잘 지낼 수 있기 때문에 즉 약을 먹어야만 계속 우울증 이 치료가 된 상태고 약을 끊으면 다시 재발하고 이루어지지 않는다는 의미입니다 양모 레모 중독된다 대선 생긴 다수 다정 생긴다 라는 것은 가장 대표적 에 그럼 그 오해라고 할 수 있겠습니다 실수로 빼먹고 혹은 좋아졌다고 생각해서 약을 중단을 한번 해 보기도 하고 그런데 그 때 나타나는 어 증상들 불편감 등이 이런 것 때문에 굉장히 두려워서 병원에 다시 오는 경우가 많아요 뭐 예를 들며 잠을 다시 못자게 된다든지 식은땀이 난다든지 부단히 11 쓴다든지 뭐 이런 여러가지 기타 이런 증상들 때문에 약을 내가 더 이상 계속 먹어야 하나 약을 끊지 못한 건강한 중독된 건가 이런 이제 불안한 을 가지고 다시 병원에 오셔서 상담을 하시게 되는 경우들이 있는데 이는 약의 중독되 거나 이렇게 절대니고요 약으로 인해서 그동안 가려졌던 증상들이 다시 어 나타난 그런 측면이 한가지 있겠고 그 번째로는 약으로 인한 중단 진국을 이라는게 있습니다 야 기회로 7 투 할 때 걸리는 시간 통상 3 4부 정도로 잡는 데요 왜냐 이젠 외하고 혈액 사이에는 두꺼운 장벽이 존재하고 거든요 거기를 뚫고 들어가는데 시간이 꽤 오래 걸립니다 반대로 게 그 약들이 뇌에서 빠져 나올 땐 생기는 그런 중 단지 그 분들이 있거든요 그런 전단 쪽으로로 인해서 약을 못 끊는게닌가 이렇게 생각하시는 경우가 많고 증상에 대한 면밀한 관찰이 필요하기 때문에 꼭 담당 주치의 란 상의하셔서 하나씩 하나씩 조금씩 끝내 시며 그중 중단 제 부분 그리고 불편감 없이 편하게 끊어질 수 있는데 이렇게 쉽게 생각하시고 그냥 끊었다가 굉장히 힘들어 줘서 오시는 경우가 많습니다 스케쥴에 맞춰서 효과와 부작용을 평가 해 가면서 그렇게 약을 조절하게 되어 있고 끊을 때도 마찬가지로 금단 증세가 없는지 서서히 게 스케쥴에 맞춰서 줄여서 점차 줄여서 이제 끊게 되어 있어요 그렇기 때문에 약을 임의로 막 1봉 먹으라고 되어 있는데 두 번 먹는다든지 2번지 또는 오늘 매일 먹어야 되는데 뭐 이틀씩 빼먹고 먹는다든지 이런 게 굉장히 증세 조절에 이렇게 좋지 않다 라는 걸 꼭 말씀을 드립니다 그렇죠 오히려 이제 그런 이제 행위들이 오일을 약에 대해서 뭐 보이죠 그리고 부자도 이런 것들을 많이 올리고 효과를 많이 떨어 뜨리고 그러니 이제 중요한 노인들이 되기 때문에 꼭 이제 만약에 뭔가 약대를 불편한게 있다 그럼 사실 주체 선생님이라고 사용해야 하는 게 정말 중요하다고 볼 수 있습니다 예 그래서 뭐 저희 모든 병의 조기 치료 예방 뭘 말씀드리자 나요 사실 병이 우울증이라고 발병 되기 전까지 그 전에 해결하실 수 있으면 좋은데 그게니더라도 정말로 병리 라고 생각이 되는 순간이라도 빨리 내용은시면 그때는 약물 치료를 했을 때 치료 효과가 좀 빨아줘 어떤 등에는 와서 얘기 하고 약을 처방받는 것만으로도 그래도 입주 래도 조금씩 더 올라 하셨다고 하는 분들도 많습니다 그런 경우는 더 빨리 내용을 할수록 더 좋아질 수 있는 시간이 좀 담겨 치죠 네 이제 저희가 이 정식과 의사이고 병원에서 부모 하다보니까 제약에 대한 얘기를 드렸고 너 인상에도 핸들 얗게 얘기 하잖이런 오해도 많이 바뀐 합니다 물론 저희가 이제 약에 대한 강조하다 보니까 그렇게 하는데요 야 물 치료의 동관 에서 3 치료를 병행하는 것이 효과가 가장 좋은것으로 알려져 있습니다 블로그에서 어이 살아서 데이또 조성수 외에도 처음에 오자마자 자세하게 경력을 다하겠습니다 그리고 이 오신 분들이 어떤 연유에서 이렇게 힘들어 졌는지 스트레스 요인은 먼지 자랑 환경에 뭔지 그런 기본적인 어떤 배경 또 어떤 이의 전국적인 요소 요런 것들도 다 확인 합니다 그리고 저희가 양 울 씨를 더 꼬셔서 그때그때 맞춰서 상담도 경 행 하구요 정신과 에서는 이걸 저희가 지적인 방법이든 또 분석을 하는 방법이든 전부다 통털어서 일괄적으로 정신치료 라고예 일컬어 4 걷으면 저희가 양만 주는 약 쌩 인사가니구요 상단과 정신치료 이걸 병행하는 거고 그게 충분히 중요하다는거 저희는 무척 잘 알고 있어서 약물치료 할 때 반드시 창당 또 같이 하고 있음을 뭐야 하지 마시라고 노파심에서 말씀드립니다 오늘 저희가 우울증의 약물 추억도 전반적 에 양모 레게 약물 치료에 대해서 말씀을 드렸습니다 또 궁금하시거나 더 필요하신 사항이 있으면 댓글로 남겨주시면 저희가 참조해서 또 좋은 홈페지 너 찾아뵙도록 되겠습니다 지금까지 정신건강 물건이었습니다 한 얘기에 되어야
https://www.youtube.com/watch?v=UEZIt2rHdCs,"[우울증, 공황장애 극복] 연예인, 유튜버들이 겪는 정신질환",정신건강 매거진입니다 오늘은 연예인은 정신건강 이라는 주제로 저런 얘기를 좀 나눠 볼 보내세요 얼마전에 굉장히 중 유명한 희극 인 4 어떤 극단적 선택주 안타까운 소식이 좀 들려왔습니다 4 그것때문에 제 저도 진료를 볼 때 굉장히 좀 마음이 영향을 받고 있다고 느끼는데 2 선생님께서는 어떠세요 많은 분들이 이제 충격을 받은 게 전혀 예상하지 못했던 네 그런 어 죽음 이었기 때문에 사실 굉장히 충격을 받은 거잖아요 그러면 그래서 많은 분들이 물어보시더라구요 환자분들이 어 그 분도 굉장히 밝고 뭐 그래 보였는데 그러면 그 우울증이 있었던 거냐 이렇게 또 많이 물어보시더라구요 그래서 어떻게 좀 음 우리가 이해를 해야 될지 그래 이제 연예인은 겉으로 보여주는거 하고 그 이면에 생활을 굉장히 좀 많이 다른 것 같아요 경쟁 님들께 술도 진료 경험이나 있으시겠지만 이런 제공이 니가 명 사람들이 병원을 찾게 되는 경우들이 생각보다는 좀 자주 있는 길이 것 같구요 그러면 n 공인 이라는 개념이 점점 더 확장되는 것 같아요 저희도 지금 유튜브를 하고 있는 사람들이지만 어 이제 진료실에 오시는 분들 중에는 상당수 유튜브를 방송 하거나 혹은 개인 방송을 하는 bj 들 복음 뭐 인스타그램 나 이런데서 유명세를 떨친 메인 프론 3rd 이런 사람들이 사실은 중 국민의 가까운 사람들이고 그런 사람들도 값이 거의 여행에 검소함 그런 정신건강에 어려움이다 위협을 좀 받고 있는 것 같구요 제가 제 경험하기 로는 우리가 보낸 그런 화려한 세계의 밑에 생각보다 많은 어떤 법적인 어떤 등 쟁 들 생각보다 굉장히 많다 그리고 이제 본인이 하는 말이나 행동 하나하나에 굉장히 큰 돈이 나오는 이미지 그리고 사람들의 빈 0 이런 것들이 걸려있기 때문에 거기서 굉장히 급박 을 많이 가지고 느끼고 있는것 같다고 좀 느껴졌어요 혹시 선생님들은 이런 면에 있는 공무원들의 정신 건강에 어떤 좀 특징인 알려고도 찾아와 보셨는지요 공부하세요 이 분들이 굉장히 화려하게 주목을 바꾼 있으신데 2 남들 눈에 좋게 보여야 되잖아요 그래야 내가 웃어야 인부들이 혹은 내가 어떤 사람으로 인식이 되고 남들에 맞춰서 거기에 나를 맞춰 가다보니 뇌가 없어지는 것 같아요 결국 남들이 날 어떻게 보냐 의 촉각을 세우고 이렇다 보니 내가 없어지면 나 자신에 대한 상실 요런 것들이 좀 클것 같고 내가 없어지는 것들이 불안해지고 결국 이런 것들이 남들 기준의 주님 7을 보다 보니 내가 너무 불안해 지고 심지어는 공항 출시까지 일어나기도 하고 또 또 이런 것들이 말을 잃게 되면서 울 강 의 에 심해지는 경우 들이 있더라구요 또 많이들 늘 언급이 되는 게 그 악성댓글 애그 빔 l1 되잖아요 그래서 악성댓글에 굉장히 상처받고 굉장히 우울해 지고 어 가족들에게도 굉장히 미안해 하면서 이제 또 극단적인 선택을 하고 이제 그런 사실 어 뉴스들도 뭐 여러 번 좀 보도가 됐던 것 같아요 내가주 유명하다는 이유만으로 나의 굉장히 사생활이 어 다하게 까 버려지거나니면은 어 전혀 그런 의도로 하지 않았는데 굉장히 악하게 나쁘게 이렇게 호도 가 되거나 전혀 말도 안되는 이제 이상한 루머들 근거 없는 그런 추측성 루머들을 파악하고 이러면서 그런걸 보면서 얼마나 불안하고 또 화가 나고 또 나 때문에 우리 가족들이 또 덩달아서 겪는 그런 고통들을 생각하면서 수술에 대해서 굉장히 죄책감도 갖고 먼저 이러면서 굉장히 정신적 고통을 받는 것 같더라구요 예 저도 뭐 예를 들어서 유튜브 한다든지니면 즘 글을 썼는데 왠지 기분나쁜 댓글 이렇게 보게 되면은 저는 그렇게 바뀌지 않는 편인데도 그런데도 되게 마음이 좀 상하고 그것 때문에 좀 꽤 오랜시간 마크 게 막 머리속에서 떠오르고 하더라구요 예 그런데 만약에 막 내가 되게 유명한 사람이고 많은 사람들이 나를 알고 있는데 그 특정 다수가 막 나쁘게 얘기하고 이러면 얼마나 스트레스 받고 힘들까 그래요 한번 너무 마음이 사실픕니다 4 그래서 요즘 을 이렇게 어 연예인의 팬들도 이런 부분에 있어서 심각 싸워야 하는지 이제 팬들이 메리즈 마케 요구를 하는 시대가 된 거 4 습관의 정신건강을 지원하는 그래서 이제 일부 어떤 이제 그럼 좀 스템을 잘 되어있는 기획사들은 네 제가 알기론 정신과 진료 나 이런 것들을 좀 필요하면 굉장하고 는 상담을 바뀌어야 예 이런 님들도 좀 있는걸로 알고 있고 예전에 이제 수화 청소년 정신의 학교에서도역 배우들에 대해 상담해 이런것들을 지원을 했었던 걸로 알고 있습니다 그런 노력들을 임 중에 이제 여행에 대해서도 이어지고 있는데 이제 그럼에도 불구하고 이런 연예인이나 도민들의 정신건강 조미 테러 온거 마차 사실인 것 같습니다 또 2분들이 더 위험에 노출될 수밖에 없는 이유가 유명하다는 이유 때문에 병원에 선택 파기가 너무 어려운 거예요 그러니까 병이 점점 더 깊어지고 중요해지고 또 치료에 어떤 시기를 놓쳐버리고 사상을 안타까운 것 같아요 외국의 경우에는 유명인들이 에 방송이다 어인 유튜브 같은걸로 오히려 좀 이렇게 편하게 좀 더 얘기를 이렇게 하는 것 같아요 우울증이나 공황장애 가아라 꼭 지금을 많이 회복했다 치료를 받았을 때 약물 치료를 받았다 이런 것들을 좀 더 쉽게 제 말을 하고 개종 절도죄에 그런 것들을 받아들여서 조금 더 정신과 에 대한 거부감이 이런것도 좀 많이 줄어드는 그런 모습이 있었는데 우리나라의 그동안 까지는 이제 워낙 정신과 진료를 쉬쉬하는 분위기였고 하지만 이제 최근엔 조금씩 의원 힘들도 자신의 그런 심리적인 어려운데 이런 것에 대해서 조금 더 솔직하게 대중들에게 좀 접근을 하는 것 같아서 바람 착한 방향으로 가고 있다는 생각이 듭니다 우리가 날 갱이 나 정식과 에 대한 나 킹 은 내가 올 층이 넘어올 앓고 있다면 이건 나를 어떻게 생각할까 이런 것들이 사실 힘든 문제고 여기에 우리한테 뭐 연인 뿐만니라 누구나에게 어려운 문제 자네 뭐 기관 재미있을 때 빨리 치료받고 약물치료 바꾼 혹은 다른 치료를 받아서 투어 지면 해령 패혈증 까지 안가는 것처럼 지금 우리가 힘들어 하는 것도 빨리 상담을 받고 혹은 필요하면 양을 추적하고 은 탈을 비약물적 치료 2반 태서 상담 받으시면 더 악화되고 깊어지지 않으실 수 있죠 부정적인 방향으로 가는 경우들이 많기 때문에 그 전에 치료를 받으신 좋긴 하죠 저는 그 특히 이제 김 브러쉬 한테 굉장히 감사하게 생각을 해요 공황장애 라고 밝힌마 최초의 연예인 분이라고 제가 기억하고 있는데 그렇게 함으로써 많은 사람들로 하여금 내가 겪는 이 증세가 공황 증세 였구나 라는것도 깨닫게 되고 사실 그 김구라 씨 같이 유명한 분이 티비에서주 유명한 프로에서 그렇게 내가 공황장애 다 라고 얘기를 하면서 그거 보면 자막 0 왕자는 향이 라는게 뭔지 처음 들어보신 분도 많으실 거예요 예 내가 이렇게 지하철만 타면 막 부분 두근거리고 답답하고 숨 못쉬고 막 메스껍고 하던게 이게 공기가 나빠서 가니고 이게 그냥 공황장애 였구나 이것을 깨닫게 되신 분도 사실 되게 많고 그래서 치료를 받으러 오신 분도 많고 를 전하실 굉장히 개인적으로 이 자리를 빌어서 정말 감사의 말씀을 드립니다 예 비 구할수 보시고 나온답니다 4 하려다가 1 잡지 말라 특히 김구라 씨 있는 말이에요 2 본인의 그런 병 뭐 이것도 이 굉장히 큰픔 일텐데 그럴때 방송에 나와서 개그 소재로주 적절히 다른 사람을 재밌게 해 주는 요소로 쓰시 이거든요 그리고 그런 김구라 씨 의 모습을 보면 이제 전혀 먹고 끌어 하거나 숨길 일이니라는 생각에 난 이게 뭐 그런 생각이 들고 게다가 김구라 션의 그런 이제 질환을 a 면서도 방송 활동 굉장히 활발하게 해 뭐 많은 사람에게 사랑을 받고 다른 열애 라고 굉장히 친하게 지금 그렇잖아요 그런 모습을 보면 안 이런 공황장애 라는 경우 예 어 그렇게 막대기주 무섭고 심각하게 만한 경우나 누구나 충분히 치료고 극복할 수 있고 일상생활을 영위할 수 있는 병이 구나 이런 느낌을 좀 많이 받아서 좀 참 대단하다고 생각이 좀 들어요 4 그 연기를 잘 내 신고 봤구요 누구나 걸릴 수 있다 누구나 앓고 있다 이렇게 중요한 얘기 같아요 평생 우리는 한 25% 이특을 국 4명 중 1명은 이런걸 겪을 수 있는 일이면 사실 저희 중에서도 그러실 수도 있고 또 소나 사인도 겪으셨던 것을 직접 얘기 해 주셨고 이럴 수 있는거고 요구나 겪을 수 있고 진행할 수도 있고 치료가 되면 그 회복될 수도 있는 이런 보니까 부끄러워할 일이니라는 거 그런 면에서는 점촌 님들 말씀처럼 좋은 어떤 그런 기회가 되기 기회를 제공해 주신 것 같아요 네 오늘은 여 개인의 정신건강에 대해서 알아봤습니다 공부만 점 있으시면 댓글 남겨 주시면 저희가 참고해서 영상으로 제작하도록 하겠습니다 지금까지 정신건강 매거진 이었습니다  어
