video_url,title,caption
https://www.youtube.com/watch?v=8UJinUaJRNE,치료 4개월 만에 엄마한테 우울증을 고백한 딸...어머니의 충격적인 반응,코코닥스의 양현주입니다 오늘은 우울증을 겪고 계신 환자분의 어머님을 모셨습니다이 자리를 마련한 이유는 환자분이 겪고 계신 우울증과 또 가족 간의 느끼는 온도차가 상당히 크거든요 그래서이 부분에 대해서 좀 다뤄보고 환자의 동의를 받아서 영상을 진행했습니다 그럼 이제 어머님을 모시고 말씀 들어보도록 하겠습니다  처음 뵙겠습니다 양용준 원장입니다네 어머니 보시기는 어떠세요이 닝닝이 정도가 이렇게 상담을 받았다고 하고 원장님을 장기적으로 됐다는 것을 알고 나한테로는 결혼 생활에 어려움도 있었지만 그래도 나름 잘 살아왔고 내 삶의 자부심을 좀 느꼈었는데 우리 세대에서는 그렇잖아요 정신과 하면 정신이 건강하지 못하니까주 심각한 상태에서 찾아가는 곳이라고 생각하고 있었는데 내 삶을 총체적으로 부정당하는 느낌 내가 내 자식에 대해서 너무 어려운다는 것 때문에 좀 서글펐죠 지금도 이렇게 먹고 싶어요 그냥 우울증이니라 기분 좋았죠 그냥 순간순간 느끼는 우울감이었으면 좋겠다 그렇게 있고 따님이프시다니까 너무 힘들어 하셨을 것 같긴 합니다 부모님이 오시면 첫 번째 말씀드릴 것은 나 때문이라고 생각하지 않으시는게 좀 좋겠습니다 내가 잘못 키워서이가 이렇게 된 거닌가 이게 부모로서 당연히 느끼는 책임감으로써 그러시는데 어떤 상황들이 있었고 그 속에서 따님이 어떤 우울증에 소인이나 이런 부분이 생겼고 뇌 기능적인 면도 있어서 그러니요 부분을 치료를 하자 요거에 더 중점을 두시는게 나고 지금 나 때문에 이랬구나 이게 왜 내가 잘못 키웠을까 이런 얘기들이 오히려 서로간에 어떤 얘기를 하는데 장애가 되고 그런 면이 있을 수는 있습니다 하나만 더 여쭤보면 담임 어떤 성격인 것 같으세요 어떤 사람인 거 같으세요 딸은 엄청 성실하고 꼼꼼하고 배려심이 많고 좋았던 부분에서는 좀 많이 소심하다 그럴까 사무실에서 어떤 진상 손님을 만났다 그러면네 잘못으로 일어난 일이니면 그렇게 속상해 안 해도 될 것 같다고 그 사람의 문제들이나 문제는닌지 않느냐 그렇게 말을 해도 털어버리지 못하고 그런 상황을 겪으면 되게 막 가슴이 두근거린다고 그 말을 좀 했었어요 따님이 어떤 면이 있는지 저희가 영상 기록을 남겼고 그 중에서 특히 따님께서 전화하고자 하는 이런 내용에 대해서 이제 또 말씀 나누도록 하겠습니다 잘 계세요 저는 남들이 시선은 엄청 많이 의식을 하는 거 평소에는 중간만큼만 하자 그냥 보통만 하자 하는데 보이는 그 시선에 집착하다 보니까 그게 제 성격이 된 거 같고 남들이 좋게는 안 봐도 나쁘게는 생각을 안 했으면 좋겠어요 직장 내에서는 일 잘한다 착한이다 이런 평가만 받았으면 좋겠는 이미 성인이시잖아요 근데 나는 좋은이 착한이라는 소리를 듣고 싶다라고 하셨네요 그러게요직 정서적으로 성인이 안 됐을까요 조금 더 얘기를 해주실까요 어렸을 때부터 저는 방치된이로 컸다고 스스로 생각을 하고 나한테 사랑을 좀 줘라는 말도 부모님께 못 했었고 이쁨 받고 싶다 이런 생각이 강했었어요 평범한 가정의이로 자라지 못한 기분 부모님이 사이도 안 좋으시고 격렬하게 싸우는 모습들도 많이 봐가지고 더 어떻게 말을 못했던 것 같아요 만약에 지금 성인이 돼서 그이를 바라보면 안 보게 하고 싶어요 그런 장면들을 구조라고 해야 될까요 꺼내서 좋은 것만 보게 하고 싶어요 어떡해  그때라도 그이를 꺼내 올 수 있으면은 지금의 저를 안 만들 수도 있잖아요 엄마랑빠랑 저랑 밥을 먹고 있는데 두 분이서 사 오셔서 목소리가 올라갔는데버지가 더 많은 칼을 가져와서 제가 보는 앞에서 클로 이렇게 나서 한 며칠 안 돼 가지고 엄마가파트 창문에서 뛰어내리려고 했는데 자식들이 있으니까 참았다는 그런 걸 제가 듣게 됐어요 그래서 정신적인 충격이 강했었던 그게 너무 생생해서 지워지지가 않아요 이건 트라우마네요 이런 영상을 보셨는데 어떤 느낌이 드셨나요 생각은 했었어요 근데 저렇게 깊은 내면을 보여주지 않아서 진료실에 오는 많은 분들께서 힘들었던 이런 것들을 얘기하다 보면 부모님이 싸울 때입니다 애기 때 내 생사 여탈골 쥐고 있는 사람 엄마빠잖아요 하늘과 땅인데 엄마빠가 싸우면 하늘과 땅이 무너질 것 같은 거죠 어른들은 싸워서 그럴 수 있나 보다 하지만이는 충격적인게 딱 박히는 거죠 근데 저는 그 장면이 생각이 나지 않아요버지랑 관계에서 도마 위에 이제 칼을 들고 왔던 요런 것들이 전혀 생각이니에요 그러면 엄마로서 그 때문에 상상을 떠올려야 되는데 그냥 떠오르죠 너무 충격적이에요빠가 좀 나를 답답하게 하거나 힘들게 하긴 하지만 그런 잔인한 행위를 할만큼 폭력적이구나 과격하지는 않거든요 30 몇 년 동안 살면서 제가빠한테 보는 가장 가격한 모습은 참기름병 한번 던진 거 그거 보기 안 봤거든요 요거는 너무나 이게 구체적이고 꿈에서 꾸었거나 요렇게라고 생각은 전혀 안 되고요마도 당시에 너무 많은 싸움이나 자주 및 달아서 그런 정도의 이러한 정도로만 넘어가셨을 수 있겠습니다 또 하나는 어머니도 이런 정도가 너무 충격적이고 힘들어서 나도 모르게 지워버리고 잊어버리셨을 수도 있겠죠 일부러라기보다는 나도 모르게 그 다음에 또 하나는 어머니가 베란다에서 뛰어내려고 했다가 가족들 생각해서 못했다 이런 얘기를 했는데 어머니 기억나시나요 남편하고 사는게 힘들어서 제가 잠시 방을 얻어서 나갔어요 근데 시댁 고모님한테 집을 나갈 수밖에 없던 상황을 말씀을 드려야 되니까 나를 방어하기 위해서 그거는 위장된 말이었어요 형님 나는 진짜 여기에서 살다가는 답답해서 뛰어내릴 것 같아서 사람이 집을 나가는게 낫겠다 싶어서 나갔다고 그런데이는 이제 사실로 그랬겠죠 실제로 베란다 앞에 서서 이렇게 뛰려고 하신 적이 있나요 저는 한 번도 그런 뭐 뛰어내리겠다는 생각을 해본 적도 없고요 자살 자체라기보다는 내가 그냥 없어져 버리면 좋겠다 그런 생각 최근에 좀 심정적으로 좀 괴로웠어요이 친정 엄마가 제 나이 때 돌아가셨거든요 혼자 중얼거렸어요 엄마는 그날 가셨네 그러면서 나도 엄마 나이만큼은 살았으니까 이제 가둬야 하냐 했겠어 엄마 나 좀 데려가 이제 문득 그 생각을 했어요 왜 그런 생각까지는 뭐 이영이 심해지고 밤이나 새벽에 통증이 심해지니까마 그래서 엄마가 위암으로 가셔서 그 생각을 이렇게 앞날이 창장하는데 죽으면 안 되죠 근데 저는이를 방치하거나 그렇게 키웠다고 생각하지 않았거든요 그럼 이제 다음 영상을 또 봐 보실까요 이거는 중학교 때 얘긴데 어머니버지가 사이가 안 좋으셔서 어머니가 갑자기 질문을 싸고 밖으로 나가시는 거예요 그래서 저는 엄마한테 엄마 가지 말고 나랑 같이 살아줘 했는데 엄마는무 말도 안 하셨던 거 같아요 그래서 엘리베이터도 같이 탔어요 엄마가 토박터봉주 힘차게 걸어가시는데 저는 차마 따라갈 수가 없고 그 저희 엄마가 멀어져 가는 모습을 보면서 울었던 것 같아요 혹은 따라가지 못하신 이유는 어떤 건가요 저를 버렸다고 생각했어요 저랑 같이 갈 생각이었으면 저를 데리고 갔었겠죠 제 짐까지 싸서 부모님이 나에게무런 사전적인 얘기도 없고빠랑 잘 살아라 이런 인사도 없고 엄마가 어디에 사는지도 모르고 연락도 안 되니까 슬펐어요 그때 당시에 마음을 조금 더 말씀을 좀 해봐주실까요 엄마가 힘들어하는 모습이 보이니까 놔둬야 될 것 같은 기분도 들었고 엄마가 나를 버렸다는 생각에 슬프기도 했고이 어린 나이에요 어떻게 혼자서 엄마 없이 살아갈까 영원히 이별한 적이었어 절망스러우셨겠네요  근데 감정을 말라 버렸나 이런 생각도 하게 되고 엄마로부터 버림받은 기억 자체를 넘어설 수 있는 더 큰픔은 없다고 느껴지시기 때문에 그런 걸까요  그래서 오히려 엄마가 우리 딸은 너무 말이 없다 너무 조용하다 이런 말씀을 하시는데 저는 그게 너무 듣기가 싫었어요 어머니는이 사건을 어떻게 기억하세요빠에 대한 악감정 때문에 과자 한치붕래에 살면 숨막혀서 내가 죽을 것 같은 생각에 들어서 그 기간이 한 달인가 그렇게 나갔는데 그때도 집 주변에서 맴돌면서빠 웃으면 가서 집중을 더 주고이들 먹을 것도 챙겨서 놔두고 그렇게 나왔었거든요 근데이는 질이 버렸더라고 생각을 했겠죠 어머니한테 같이 살자고 붙잡았다고 하는데 우리 흥민이 드라마에서 보면 엄마빠랑 헤어지면서 애들이 막 울고불고 하면 그 장면이 떠오르듯이 나를 붙잡았다는 어머님으로서는이가 애는니니까 중학교 때라고 하면 그래서 너 잘 있을 수 있겠지라고 생각하셨을 수는 있지만 여전히 닉네임은 엄마가 이렇게 가버리면 나는 어떻게 살아야 되나이 얘기를 따님하고 만약에 나눈다면 어떤 말씀을 좀 하고 싶으실까요 그 당시 엄마가 왜 집을 나갔어요 됐고 정말 설명 없이 너희한테 상처를 줘서 너무 미안하다 엄마가 너무 무지했었다 앞으로 엄마가 더 노력할게 그리고 마지막으로 이제 표정이 없다 이렇게 얘기를 하면 되게 싫어한다고 하셨는데요 부분에 대해서는 어머니는 어떻게 좀 생각을 하시는지요 그러니까 나는 애가 의사표현이 없고 무표정하고 마우스가 없다 그런 것을 어떤 dna겠지 그렇게만 다 한정을 하고 처음에 얘기하는 걸 듣고 이것이 웃으시는게 우리 딸이 이렇게 얘기 잘하고 있었구나 요런 느낌을 좀 받으셨던 것도 같은데 몰랐어요 정말 나는 내 자식을 내가 잘한다고 생각했는데 너무 많이 몰랐네요 또이 말도 해주고 싶어요 엄마는 그렇게 무식하게 살아왔지만 그래서 엄마 같은 사람은 되지 않게 해서는 지금부터 어떤 것이 필요하겠는지 서로 같이 잘 풀어가 보자 그렇게 말해주고 싶어 저희가 지금까지 영상을 봤는데 따님이 어머니한테 뭘 바라는 거 같으신가요 나를 알아달라요 알아달라고 하는게 큰 거는 없습니다 그냥 들어 달라는 겁니다 그런데 제가 오늘 어머님을 봐서 느꼈던 것은 어머니도 도움을 좀 받으실 수 있으면 좋겠다는 생각을 했어요 여러 근거 중에 하나는 특히 도마사건 기억을 못 하시는 거잖아요 그만큼 힘들었던 것을 지워버렸을 수도 있고 또 하나는 닉님께서 겪고 있는 힘든 정도를 내가 같이 살면서 모르고 계셨다는 거 그러면 왜 모르느냐 어머니가 힘들기 때문에 모르는 거죠 내가 못 견디고 죽을 것 같아서 집을 나가셨던 것처럼 내가 견딜 수 없고 힘드니 남의 얘기를들을 수가 없습니다 그리고 남이 어떻게 정도인지 알 수도 없죠까 얘기하셨던 얘기가 그거잖아요 엄마보다는 더 나은 사람 되기를 바란다는 건데 지금 어머니가 나아지시면 따님도 더 나아질 수 있습니다 다음 세대를 굳이 미루지 않더라도 지금 어머니가 좋아지시면 자신의 삶도 좋아지시고 따님과의 관계도 훨씬 더 개선될 수 있습니다 내가 변해야 자식도 살고 저도 사는 길이군요 하나 좀 더 여쭤보면 어머니 자라 오시면서 다독거려주고 너 힘들었어 요런 것들을 우리 어머님들 다 그게 쉽지는 않았지만 부족함을 느낀 적이 있으셨어요 부모님으로부터 사랑을 흠뻑 받거나 어린 시절은니었던 것 같아요 세 번째 마지막에들이었나요 그러면 혹시 집에서 남동생에게 좀 더 관심이 기울어진게 있나요 막내들이었으니까무래도 저는 치웠겠죠 또들 낳으려고 남동생하고 몇 살처럼예 관심이 많이 끊어지셨겠네요 나는 그때 부모님한테 뭘 바라셨어요 바라는게 없었던 거 같그래서 서글퍼요 바랄 수 있는지도 모르지 어렸을 때부터 저는 방치된이로 컸다고 스스로 생각을 하고 나한테 사랑을 좀 줘라는 말도 부모님께 못 했었고 이쁨 받고 싶다 이런 생각이 강했었어요 제가 이제 어머니한테 하나 말씀드리고 싶은 건 첫 번째로 부모는 많이 민감하긴 해야 됩니다이이가 바라는게 분명히 있어요 지금 그게 뭔지 들어보시고 두 번째는 사랑은 행동입니다 행동 어머니도 말씀하시나요 잘 갔다 와 하고 안아주기도 하고 엉덩이도 토닥거리고 했는데 정말 말을 표현은 안 했네 요거를 쭉 계속 하셔야 됩니다주 일관되게 계속 또 하나의 닉님이 어머니에게 좀 전달했으면 하는 내용이 있어요 어머님이 왜 나한테 얘기를 못 했을까 그러면서 이제 내가 자책을 하게 된다고 하셨잖아요 이를테면 남편분과 싸우게 되는데빠가 엄마한테 비난하는 얘기를 했을 때 차라리 엄마가 화를 내면 좋겠는데 화를 내지 않고 내 자책을 하게 되니까 그거 자체도 또 화가 난다는 거예요 어머니가 자책을 하는 모습을 보는 딸로서의 모습은 또 힘든 거죠 그러면 이거를 엄마한테 얘기를 할 수가 없게 되죠 오늘의 전반적인 얘기들도 이런 일로 인해서 힘들었었다를 알아주라는 거지 이런 일이 엄마 때문이니까라고 얘기 드리는게니니까 어머니가 자책을 하시지 마시라 다시 한번 얘기 드리지만 엄마가 건강해지셔야 내 자식한테도 건강하게 대할 수 있고 또 따님도 엄마한테 믿고 의지하고 기대할 수 있고 애교 부릴 수도 있는 거거든요 궁금하신 거 하시고 싶은 말씀 다른 더위를 고맙네 그리고 다른 사람 통해서 또 할 수 있는 기회를 줘서 고맙고 딸이 엄마를 위해서이 시간을 좀 마련해둔 것 같아이 시간에 엄마를 위하는 시간이었네 지금 얘기하시는게 되게 좋네요 이게 결국 엄마를 위해서 마련해 준 시간이구나 그게 고맙다고 하는 거 딸도 도움을 받아야겠지만 저도 좀 도움을 받아야 될 것 같은 생각을 드네 오늘 정말 감사해요 또 도움이 필요하면 언제든지 말씀을 좀 해 주십시오네 오늘이 자리에서 우울증을 겪고 계신 환자분 어머님을 오시는 귀한 자리를 마련해 봤습니다 오늘이 영상을 보시고 나의 부모 나의 자녀와 비슷한 겹치는 부분이 있으시다면 생각해 보시고 또 필요한 부분들이 있으시면 댓글 남겨주시면 저희가 참조해서 말씀드리도록 하겠습니다네 이상 코크닥스의 양용준이었습니다  있습니다
https://www.youtube.com/watch?v=Jv2hrbs5Ynw,부자 동네 vs 가난한 동네 중 우울증 환자가 더 많은 곳은? #shorts,우울증은 가난의 질병이라는 말이 있습니다 경제적 어려움으로 스트레스 불안증상을 많이 겪기 때문인데요 그렇다면 돈이 많으면 안우울할까요 의외로 부자동네에 우울증 진료 환자가 더 많습니다 서초 강남 동작구순이죠 왜 그런가 봤더니 능력있고 성공한 사람은 스스로 정한 기준이 높은데 이게 잘못되면 큰 스트레스를 받아서 우울증으로 이어지는 겁니다 하지만 정반대의 연구결과도 많습니다 상해 개수 고용 형태 신용도 이런 것들을 살펴보니까 사회경제적 수준이 낮을수록 우울하다는 연구도 있어요 그럼이 현상을 어떻게 이해하면 좋을까요 우울증은 유전적 취약성이 스트레스에 의해 촉진되는 질병입니다 근데 스트레스는 누구나 다 받잖아요 하지만 스트레스 관리 우울증 치료에 중요성은 소득 수준에 따라 이해도가 다른 것 같아요 정신과 방문과 약물치료에 대한 거부감도 다르고요 정신건강에 대한 점검과 대처 누군가는 미리미리 하고 있다는 거 이렇게라도 권장드립니다
https://www.youtube.com/watch?v=0uKXHxeJcmE,"엄마는 나의 우울증을 이해할 수 있을까? I 가정폭력, 기억상실, 트라우마 #shorts",남들이 좋게는 안 봐도 나쁘게는 생각을 안 했으면 좋겠어요 착한이다 이런 평가만 받았으면 좋겠는 이미 성인이시잖아요 근데 나는 좋은이 착한이라는 소리를 듣고 싶다라고 하셨네요 평범한 가정의이로 자라지 못한 기분 엄마랑빠랑 사오셔서 목소리가 올라가는데버지가 정말은 칼을 가져와서 제가 보는 앞에서 클로 이렇게 대놓고 그게 너무 생생해서 지워지지가 않아요 근데 저는 그 장면이 생각이 나지 않아요 그러면 엄마로서 그 장면이 상상을 떠올려야 되는데 그냥 떠오르죠 요거는 너무나 이게 구체적이고 꿈에서 꾸었거나 요렇게라고 생각은 전혀 안 되고요 어머니도 이런 정도가 너무 충격적이고 힘들어서 나도 모르게 지워버리고 잊어버리셨을 수도 있겠죠
https://www.youtube.com/watch?v=Ol2Etra2Bls,엄마는 나의 우울증을 이해할 수 있을까? 2탄 I 부부싸움 #shorts,엄마랑빠랑 싸우셔서 목소리가 올라갔는데버지가 저 말은 칼을 가져와서 제가 보는 앞에서 클로 이렇게 대놓고 나서 엄마가파트 창문에서 뛰어내리려고 했는데 자식들이 있으니까 참았다는 제가 듣게 됐어요 최근에 좀 괴로웠어요 친정 엄마가 제 나이 때 돌아가셨거든요 혼자 중얼거렸어요 엄마는 그날 가셨네 그러면서 나도 엄마 나이만큼은 살았으니까 이제 가둬야 하느라고 문득 그 생각은 했어요 이영이 심해지고 밤이나 새벽에 통증이 심해지니까마 그래서 엄마가 위암으로 가셔서 근데 자식들 이렇게 앞날에 창장하는데 죽으면 안 되죠
https://www.youtube.com/watch?v=UnR47CllRIk,야망·능력·즐거움이 중요한 이유,부자들은 안 우울할까 한낮의 우울이라는 책에 이런 내용이 있습니다 중산층에 찾아온 우울증은 상대적으로 발견하기 쉽다 만족스러운 삶을 영위하다가 갑자기 이유 없이 일이 싫어지고 자기 삶에 통제력을 잃는다 그래서 주위 사람들의 우려와 관심을 끌게 된다 비정상적으로 비치기 때문이다 그러나 밑바닥 계층의 사람들의 찾아온 우울증은 눈에 띄기 어렵다 그들에게 인생은 늘 비참하고 불만족스러운 것이기 때문이다 무언가를 이루겠다는 뜻을 품어본 적도 없다 이들의 상태는 어떤 것이 정상적이고 어떤 것이 우울증에 병적 상태인지 구분이 어렵다 그래서 가난한 우울증 환자들을 치료하는 것은 그들이 야망과 능력 즐거움을 발견할 수 있도록 해주는 것이다 저도 환자에 따라서 치료를 설득하는 것이 굉장히 힘든 경우들이 있는데요 모든 정신과 의사는 개별화된 진료를 합니다 어떤 증상이 있는지 누가 힘들게 만들었는지 어떤 사건이 힘들었는지 모든 걸 듣고 약물치료만이닌 현실적으로 헤쳐나갈 방법을 함께 고민하려고 노력합니다 그러니까 마음이프다면 언제든지 정신과를 찾주시길 바랍니다
https://www.youtube.com/watch?v=2oIb5DG5DgE,마음이 불안한 사람이 연애하면 생기는 일 #이별,사랑할 때 불안해 본 적이 있으세요 상대가 내 부족한 모습을 보고 실망해서 날 떠나면 어쩌지 이런 불안해요 근데 이런 마음이 행동으로 나타나게 되면 상대한테 엄청 집착하거나 반대로 연인한테 안 빠지려고 거리를 더 두긴 하거든요 이거 왜 이럴까요 사랑의 중요한 뼈대 중 애착이라는게 있습니다 어린 시절 가족관계에서부터 시작되는 건데요이 과정에서 안 좋은 일을 겪으면 애착 트라우마가 생겨서 불안정 애착이 자리잡게 되기도 합니다 이게 성인기 연인관계까지 영향을 주는 거죠 그래서 내 연애가 늘 어렵다고 느낀다면 나의 불안한 마음이 상대가니라 내 자신에게서 비롯된 문제임을 받아들여야 합니다 다행인 건이 애착 유형 바뀔 수도 있다는 겁니다 한 사람과 안정적인 관계를 오랫동안 유지하면 바뀌기도 하는데요 그렇다고 해서 서로가 모든 것을 다 이해하고 받줘야 된다는 것을 의미하는 건닙니다 누구에게나 자신만의 심리적 공간과 거리두기가 필요하기 때문인데요 그래서 나 혹은 상대의 마음 그대로를 인정하고 들어주되 연인끼리 해결이 어렵다면 정신과 의사를 찾조언을 얻어보길 바랍니다
https://www.youtube.com/watch?v=9EsEZpgHd4Y,정신과 의사의 경고 '유튜브 보는 아이들 뇌에서 벌어지는 일'  #shorts,식당 가면 애들한테 스마트폰 쥐어주시는 부모님들 있죠 이거 이거 애들 정신건강에 마이너스가 되면 마이너스가 됐지 플러스 될 걸 하나도 없습니다 이건 스마트폰 시청 시간과 건강 사이에 연관성 연구 자료인데요 지방세포 증가 심폐 직구력 감소 등 신체 건강에 치명적인 것 당연하고요 올 불안을 야기하고 사회성에도 부정적인 영향을 준대요 왜 그러느냐 tv는 바보상자다이 말 들어보셨죠 영유언어발달에는 쌍방향성 의사소통이 중요한데 tv나 유튜브나 보고 듣기만 하고 반응할 필요가 없는 일방향적 의사소통이기 때문이죠 그리고 또 하나 여기가 뇌의 백질 부위인데 뇌의 전기신호가 지나다니는 길입니다 스크린 타임이 긴이는 백질에서 뇌전기 신호전달 속도가 현저히 느렸다는 겁니다 물건의 이름을 대는 점수가 낮게 나오고 읽기 쓰기 능력이 낮았어요 자 내이의 유튜브 시청 두 살 미만은 모든 미디어를 피한다 5살 미만은 부모가 골라준 영상으로 1시간 미만 시청 꼭 기억해 주시길 바랍니다
https://www.youtube.com/watch?v=6WAGzTvsyFU,우리 뇌가 스스로 기억을 삭제하는 이유,망각하는 자는 복이 있나니 자신의 실수조차 있기 때문이라이는 철학자 니체의 말입니다 기억상실 진짜 곡일까요 저는 복음 맞긴 맞지만 한시적인 복이라고 생각합니다 우리 뇌는 강한 스트레스를 받거나 트라우마를 겪으면 우리도 모르게 기억을 삭제해 버려요 정신과에서는 이걸 기억 장애라고 부르죠 예를 들면 중학교 때 왕따를 심하게 겪은 분은 중학교 때 뭘 하고 지내는지 전혀 기억을 못하기도 합니다 학창시절 기억이 통째로 날아가 버리는 겁니다 또한 올과 불안으로 상담 치료를 받던 환자가 증세가 호전되면서 어릴 때 옆집저씨로부터 성추행을 겪었던 사건을 30년만에 떠올리는 분도 계십니다 이렇게 심각한 폭력 성폭력에 노출될 때 말고도 견디기 힘든 죄책감과 절망감 강한 분노의 감정을 느낄 때도 나를 방어하고자 무의식적으로 기억 장애를 일으킵니다 드라마나 영화에서 내 이름은 뭐고 가족은 누군지 모두 잊어버리고 새로운 곳에서 새로운 직업과 일상을 시작하는 경우가 있습니다 주 드물지만 실제로 있는 일입니다 다시 돌아와서 빛의 이말 사실은 영화 이터널 선샤인에서도 나온 말인데요 주인공 조엘이 클레멘타인과의 추억을 잊으려고 기억을 지어준다는 회사에 가서 몽땅 지워버리는 이런 일을 기억하시는지요 그런데 결국은 다시 한번 똑같이 사랑에 빠지게 됩니다 마치 운명적으로요 니체는 이성에 의해서 묻어 두었던 감성의 중요성을 강조한 철학자입니다 그래서 망각하는 자는 복이 있나니 자신의 실수조차 이지라는 말은 이성의 채찍질에서 망각됐던 것을 넘어서서 감성적인 부분을 중요시해야 된다 이런 의미라고 저는 해석하였습니다
