video_url,title,summary
https://www.youtube.com/watch?v=rEU188kpWPA,3분만에 알고싶다 - 그냥 우울한거랑 우울증이랑 어떻게 달라? 조울증은? [뇌부자들],"처음에 잘 모를 때는 '내가 우울하구나' 그렇게 생각했었는데, 정신과의 모든 것을 3분만에 알려주겠다. 오늘의 주제는 우울증을 정확히 설명하겠다. 몇 가지 질문을 준비했다. 자, 첫 번째 질문. 그냥 우울한 느낌과 우울증은 어떻게 다른가요? 가장 많이 듣는 질문이다. 단순한 우울감은 누구나 느끼는 건데, 솔직히 안 느껴본 사람이 어디 있겠는가? 하루 이틀 비 오는 날, 반나절 정도 비 오는 순간 같은 것들이 우리가 흔히 경험하는 우울감이고, 장마 기간 2주 연속 계속 비 오는 날이 우울증이라고 이해하면 된다. 오동쌤, 9가지 기준에 대해 얘기해 주시죠. 

일단 하루 종일 우울한 기분이 지속되는 것, 그리고 대부분의 영역에서 흥미의 감소를 보이는 것이 주된 증상이다. 이 둘 중 하나는 반드시 있어야 진단을 하게 된다. 그리고 식욕의 변화, 즉 식욕이 늘어난다든지 줄어든다든지, 수면의 변화, 과수면 또는 불면, 정신운동 초조 혹은 지체, 쉽게 말하자면 안절부절 못하거나 늘어지거나, 피로, 에너지의 고갈, 무가치감이나 부적절한 죄책감을 느끼는 것, 집중이 안 되고 사고 능력이 저하되는 것, 마지막으로 반복적인 자살 사고나 죽음과 관련된 생각을 하는 것이다. 그러나 9가지 진단 기준 중 5가지 이상이 거의 매일, 하루 중 대부분을 차지하며 2주 이상 지속되어야 하며, 이걸 경험해 본 사람들은 많지 않다. 전체 유병률은 약 10% 정도라고 한다. 즉, 10명 중 1명은 인생에서 한 번쯤 이런 기간을 경험한다는 것이다. 이러한 진단 기준을 만족하면 주요 우울 장애를 고려하게 된다. 

주요 우울 장애 진단을 내리려면 앞서 언급한 증상들 때문에 사회적 기능, 직업적 기능에 꽤 유의미한 손상이 있어야 한다. 회사원들은 업무 능력이 갑자기 떨어지고, 학생들은 성적이 뚝 떨어지는 확연한 변화가 생긴다. 사람들과의 약속도 안 잡고 모임에도 참석하지 않는 경우가 많다. 주요 우울 장애를 진단할 정도라면 본인뿐 아니라 주변 사람들도 '정말 평소와 다르다'라고 느낄 정도가 된다. 

다음 질문으로 넘어가 보자. 주요 우울증, 기분부전장애, 초울증은 어떻게 다른가요? 주요 우울 장애는 주요 우울 에피소드가 있는 것이다. 살면서 한 차례만 있어도 주요 우울 장애로 진단할 수 있다. 문제는 이 경우 재발하는 경우가 많다는 것이다. 한 번 재발하면 다음에 또 재발할 확률이 올라가기 때문에 꼭 치료를 받아야 한다. 

기분부전장애는 '죽고 싶지만 떡볶이는 먹고 싶어'라는 표현이 최근 인기를 끌었던 책에서 나온 질병인 지속성 우울 장애와 같은 의미를 가진다. 간단히 말하자면 주요 우울 장애 수준은 아니지만 분명한 우울감이 있는 상태라고 볼 수 있다. 진단 기준에 약간 차이는 있지만, 쉽게 말해 우울감이 있으면서 주요 우울 장애 기준 중 두 가지만 추가로 만족하면 되는 상태라고 생각하면 좋겠다. 대신 주요 우울 장애가 2주 기간이었다면, 기분부전장애는 길게 2년 정도 지속되는 상태여야 하며, 2년 중 증상이 없는 기간이 2개월 이상이면 진단을 내릴 수 없다. 

결국 정리하자면, 만성적으로 기억하는 한 계속해서 우울했던 것 같은데 기분 점수가 최악인 0점, 1점 정도는 아니지만 3점을 넘지 않는 상태가 지속되는 것, 이것이 기분부전장애, 즉 지속성 우울 장애이다. 이미 3분이 지났을 것 같은데, 오늘은 그냥 망한 걸로 하고, 조만간 5분 시리즈로 바뀌지 않을까 싶다. 보통 우울증과 지속성 우울 장애는 우울한 기분이 깔려 있다가 중간 정도로 올라오고 그냥 끝나지만, 잘 지내다가 갑자기 기분이 너무 올라버리는 경우가 조울증이다. 이상하게 기분이 들뜨거나 지나치게 예민해지거나 혹은 에너지가 넘쳐 하루에 한두 시간만 자도 피곤하지 않고 말도 빨라진다. 이런 모습이 조증이다. 

이런 기간이 1주 이상 지속되면 조증 삽화라고 한다. 만약 입원 치료가 필요할 정도 크면 조증 에피소드, 그렇지 않고 평소와 다르게 에너지가 넘치고 많이 들떴다면 경조증이라고 한다. 경조증은 4일 이상 지속되면 진단이 가능하다. 조증이 한 차례라도 나오면 1형 양극성 장애가 진단된다. 경조증만 반복되면 제2형 양극성 장애로 진단할 수 있다. 처음 병원에 왔을 때 우울한 기간만 있어서 환자와 의사가 모두 '아, 우울증이군요'라고 알고 있다가 나중에 조증이 나타나면서 진단이 조울증으로 바뀌는 경우도 꽤 많다.

추가적으로 말씀드리자면, 우울증 치료 중 급격히 좋아지는 경우가 있다. 약을 써야 하는데 1~2주 만에 기분이 좋아지는 경우, 처음에는 자신이 우울하다고 생각했지만 이제는 '이건 큰일 나게 될 수 있다'고 생각하게 되는 경우도 있다. 오늘은 기분장애들에 대해 구분해서 이야기했는데, 지속되는 우울감의 원인은 단순히 기분장애뿐만 아니라 성격적인 요인이나 갑상선 호르몬 등의 신체적인 요인, 약물이나 알코올 같은 물질이 영향을 줄 수 있다. 이러한 진단 기준에 맞춰서 진단을 해보는 것이 필요하지만, 이런 부분이 의심된다면 반드시 전문가에게 진료받기를 권장한다.

우리가 세부적으로 기분장애를 구분한 이유는 각각의 질환에 따라 치료법이 다르기 때문이다. 다음 5분 시리즈에서는 각각의 기분장애에 따라 치료법이 어떻게 달라지는지에 대해 이야기하겠다."
https://www.youtube.com/watch?v=oNVEL7p5RQM,소리에 예민한 것도 우울증 증상? 설마 나도? [뇌부자들][사연상담],"오늘은 고민을 가진 분의 사연을 받아 함께 고민해보는 시간을 가지겠습니다. 오늘의 사연은 28살의 한 여성분으로, 우울증 진단을 받았고 집안에 다른 사람이 있으면 스트레스를 받는다고 합니다. 그녀는 다른 사람이 움직이는 소리만 들려도 신경이 곤두서고, 특히 두 사람이 대화할 때 그 소리가 듣기 싫어서 핸드폰으로 음악을 듣습니다. 이 문제는 과거 아버지와의 생활에서도 겪었던 일로, 그녀는 사람과 대화하기도 싫고, 누군가와 함께 있는 것 자체가 스트레스라고 합니다. 혼자 살고 싶어도 우울증으로 인해 일상적인 생활조차 어렵고, 경제적으로도 독립하기 힘든 상황이라고 합니다.

이분은 자신과 같은 고민을 다른 사람에게 이야기해도 해결되지 않을 것 같고, 사람 존재 자체가 스트레스로 느껴진다고 하니, 이 상황이 얼마나 힘들고 괴로울지를 짐작할 수 있습니다. 

가장 두드러진 증상은 소리에 대한 극도의 민감함으로, 청각 과민증일 수 있습니다. 이런 경우, 특정한 소리에 대해 강력한 감정적 반응이 일어날 수 있으며, 이러한 감정은 불안, 분노 등 다양한 형태로 나타날 수 있습니다. 실제로 주변 사람들이 내는 일상적인 소음조차도 큰 스트레스가 될 수 있습니다.

이분의 과거를 살펴보면, 어머니와의 관계에서의 트라우마가 있었고, 아버지와 할머니를 잃은 후 우울증 진단을 받게 되면서 사람들과의 관계에서 더 어려움을 겪게 된 것으로 보입니다. 이렇듯 과거의 경험들이 현재의 상태에 영향을 미치고 있다는 점에서, 정신적 고통이 감각적으로 어떻게 연결되는지를 고민할 필요가 있습니다.

조언을 드리자면, 이분은 우울증 진단을 받고 있으니 약물 치료를 권장합니다. 심리 상담도 꾸준히 받고 있으니, 두 가지 치료를 병행하면 더욱 긍정적인 효과를 볼 수 있을 것입니다. 상담사와의 관계를 통해 공감받고 지지를 받을 수 있는 기회가 있으며, 인간관계에서의 혐오감이 어디에서 비롯된 것인지 탐색해보는 것도 중요합니다. 

결론적으로, 치료의 필요성을 느끼는 것은 첫 걸음이며, 도움이 될 만한 방법들을 모색하는 것이 중요합니다. 이러한 고민이 힘드신 분들에게 조금이나마 도움이 되길 바랍니다."
https://www.youtube.com/watch?v=Q0j1gs78glg,너무 오랫동안 우울하다면 '이것'을 의심해 보세요!,"성격적인 특성이나 심리적인 특성이 작용하면 회복을 더디게 하거나 한계를 갖게 하는 경우들이 있는 것 같습니다. 굉장히 안타깝지만 평생 우울감을 느끼시는 분들이 계십니다. 진료실에서 그런 이야기들을 많이 들었는데, 어떤 말씀을 하시는지 궁금합니다. ""굉장히 오랫동안 우울해왔다""라는 이야기를 넘어서 ""언제부터 시작됐는지 잘 모르겠다. 기억에 있는 한 다 우울했다""는 분도 있습니다. ""우울하지 않았던 적이 없다""는 질문도 자주 듣습니다. ""선생님, 어떻게 안 우울해요? 그게 당연한 거 아닌가?""라는 이야기도 하시기도 합니다. 이런 얘기를 들을 때, 저희도 이분의 문제에 대해 생각해 보게 됩니다. 이럴 때 어떤 정신과적 진단명이 가능할까요?

대표적으로 생각할 수 있는 진단명이 바로 지속성 우울장애입니다. 이 진단명은 DSM-5에서 처음 등장한 것으로, 4판까지는 기분부전장애라는 진단명이 존재했습니다. 이는 조금 더 확장된 개념으로 이해할 수 있습니다. 우선 이 병은 적어도 2년 동안 하루의 대부분 우울한 기분이 있으며, 우울한 기분이 없는 날보다 있는 날이 더 많아야 합니다. 이러한 기준은 주관적이거나 객관적으로 관찰되어야 합니다. 2년의 기간이 중요하며, 이 기간 동안 하루도 빠지지 않고 우울할 필요는 없지만 적어도 대부분은 우울했어야 합니다.

우울한 기간 동안, 다음 중 두 가지 이상의 증상이 나타나야 합니다. 증상으로는 주요 우울장애의 진단 기준과 겹치는 부분이 많습니다. 식욕 부진 또는 과식, 불면 또는 과다수면, 기력 저하나 피로감, 자존감 저하, 집중력 감소 또는 우유부단함, 절망감 등이 있습니다. 이 6가지 중 두 가지 이상이 우울감과 함께 나타나고, 기간이 2년 이상 되었을 때 진단할 수 있습니다.

혹시 지속성 우울장애를 겪는 중에 주요 우울장애가 발생할 수 있을까요? 그렇습니다. 기본적으로 어느 정도 기분이 다운되어 있는 상태에서 주요 우울장애가 찾아오는 경과도 보일 수 있습니다. 이러한 경우에는 주요 우울장애 시기가 지나가더라도 기분이 완전히 회복되지 않고, 우울증상의 일부가 계속 남아 있는 상황이 발생합니다. 아동 및 청소년의 경우에도 기준이 조금 다릅니다. 성인은 우울한 기분으로 나타나는 반면, 아동이나 청소년은 예민하고 짜증스러운 기분으로 나타나는 경우가 많습니다. 또한, 성인은 2년을 기준으로 하지만, 아동과 청소년은 1년만 충족해도 지속성 우울장애 진단이 가능합니다.

정신과 의사들은 이 진단을 어떻게 바라볼까요? 성격적인 특성으로 이해하는 것이 좋습니다. 자존감 저하가 진단 기준에 포함되어 있다는 점이 흥미로운데, 사건을 대할 때 큰 고통을 받는 경우가 많습니다. 이에 따라 우울감 및 다른 증상들도 심하게 나타나고 오래가는 경우가 많습니다. 성격장애나 인격장애와는 다르게 이러한 심리적 특성이 우울감을 쉽게 느끼게 합니다.

또한, 생물학적 취약성과 심리적 요인이 결합되어 우울증이 생긴다고 볼 때, 개인의 심리구조 특성이 더 많이 작용하는 영역이 아닐까 싶습니다. 호르몬 변화가 문제가 아니라면 약물치료로도 개선될 수 있지만, 성격적인 특성이 회복을 더디게 만들 수 있습니다. 지속성 우울장애를 겪는 분들은 과거의 큰 트라우마로 인해 작은 자극에도 민감해질 수 있습니다.

종합하자면, 지속성 우울장애는 단순한 유형의 사람만을 말하는 것이 아니라 다양한 원인을 포함한 집단입니다. 심리적인 요인이 클 수 있으나, 뇌의 기질적인 요인 또한 영향을 미칠 수 있습니다. 약물치료를 통해 큰 변화가 일어날 때, 뇌의 기질적 요인이 주효했음을 알게 됩니다. 지속성 우울장애에 대해 약물치료보다 심리치료가 중요하다고 배웠지만, 실제 임상에서 약물치료로 기분이 좋아지고 죽음에 대한 생각이 사라지는 경우도 많습니다. 이러한 변화에 감사하는 분들을 만나면, 저도 민망할 때가 있습니다. 오랜 고통을 겪은 분들이 약물도 소량이라도 유지하며 잘 드시는 경우를 보게 됩니다.

지속성 우울장애에 대해 이야기해봤고, 다음 영상에서는 우울하게 만드는 성격적 특징에 대해 좀 더 자세히 소개할 예정입니다."
https://www.youtube.com/watch?v=Fy4E9TMlP6Q,우울증 재발 확률 75%...? 우울증의 재발을 막는 방법은?,"진리에게 나온 김에 한마디 더 드리고 싶은데, 술 드시면서 약 걱정하시는 것은 큰 문제가 있다. 오늘 방송에서는 우울증이 발생한 후에 어떤 식으로 흘러가는지에 대해 말씀드려보려고 한다. 가장 먼저 일반적으로 우울증, 그중에서도 주요 우울장애라고 부르는 전형적이고 다소 심각한 형태의 우울증을 기준으로 말씀드리겠다. 일반적인 경과부터 말씀드려보자. 다들 아마 궁금하실 것이다. 내 병이 앞으로 어떻게 되는지, 얼마나 낮고 얼마나 재발하며, 얼마나 있어야 끝나는지 등 다양한 것들에 대해 궁금하실 것이다. 그래서 안타깝게도, 우울증은 만성화하는 경우가 많다. 한 번으로 끝나지 않는 경우가 많다. 우울 에피소드라고 하면 보통 반년에서 1년 정도 지속되다가 끝나고, 힘든 기간이었다고 생각해도 치료받지 않은 경우에는 특히 재발이 더 많이 발생한다. 재발율은 치료받지 않은 경우, 6개월 이내에 25%, 2년 이내에 50%, 5년 이내에는 75%가 다시 우울 기간을 겪게 된다고 한다. 5년 이내에 75%가 재발한다고 하니 정말 답답하게 느껴진다.

하지만 중요한 것은, 방금 언급한 것처럼 치료를 받지 않은 경우에 이렇게 된다는 점이다. 치료를 꾸준히 잘 받았을 경우에는 재발 리스크가 많이 줄어든다. 어느 정도로 떨어지느냐 하면, 연구에 따라 다르지만 약 3분의 1에서 5분의 1까지도 줄어든다고 보고되고 있다. 많은 분들이 항우울제의 효과는 없다고 주장하며 공격을 하시지만, 항암 치료를 받을 때 재발율이 3분의 1에서 5분의 1로 떨어진다고 하면 누구나 다 할 것이다. 그래서 이러한 연구 결과에 따르면, 재발 방지를 위해 항우울제 복용은 반드시 필요하다. 치료를 처음에 잘 하는 것이 매우 중요하다.

우울증을 겪은 후에는 한 번 뇌의 기능이 저하되고 스트레스에 취약해지는 뇌가 된다. 운동을 많이 하다 보니 발목 같은 데 자주 삐게 되는데, 치료를 잘 받지 않은 쪽 부위는 잘 접질리게 된다. 이런 경우도 마찬가지로, 우울증도 내가 한 번 다친 상태이고 회복이 되었더라도 여전히 취약한 상태이기 때문에 재발 가능성이 높다. 증상이 좋아졌다는 것 이상으로, 재발을 어떻게 막을 것인가에 대한 고민이 필요하다. 이 답은 충분한 기간 동안 항우울제를 복용하는 것이다.

또한, 항우울제나 정신 치료를 받아야 하는 이유는 치료를 받지 않았을 때 우울증으로 인해 죽음으로 이어지는 경우가 10%에서 15%에 이르는 경우가 있기 때문이다. 정신과 질환 중에서 이처럼 죽음으로 이어지는 비율이 가장 높은 질환이 아닐까 싶다. 이제까지 일반적인 우울증 경과에 대해 말씀드렸고, 여기서 조금 더 나쁜 경과를 예상할 수 있는 요인들이 있는지에 대해 말씀드리겠다.

대표적으로는 알코올 의존이 있다. 알코올 의존이 있는 경우에는 회복이 어렵고 경과가 매우 안 좋다. 술을 끊으라고 해도 잔소리처럼 넘기는 경우가 많다. 알코올 사용 장애가 있는 분들은 우울증의 재발이 더 많고, 우울증 자체가 뇌의 기능 저하로 인해 생기는 다양한 증상들을 총칭하는 것이므로, 술이 뇌의 기능을 저하시키는 것을 모르는 분들이 많다. 과도하게 술을 드시는 분들은 마약을 사용하는 것과 다르지 않다. 마약을 사용하면서 우울증 치료가 가능할까? 일상생활을 제대로 할 수 있을까? 안 되는 것이 뻔하다.

특히 여러 정신질환이 동반될 경우 문제가 되며, 알코올 의존이 있을 때 더 큰 문제가 된다. 불안 증상이 심한 경우도 한 가지 요인으로 볼 수 있다. 정신운동성 초조와 같은 증상으로 매우 안절부절 못하는 경우, 만성적인 불안감이나 긴장감을 안고 있는 경우, 이런 불안형 우울증은 예후가 좋지 않다. 이런 증상들은 견디기 어렵기 때문에 극단적인 선택을 할 가능성이 높다. 여러 차례 재발이 있는 경우 이후 경과에 부정적인 영향을 미친다. 두 번 재발한 경우에는 50%에서 재발할 수 있다고 하며, 세 번 재발한 경우에는 이후 90% 이상에서 재발할 수 있다고 알려져 있다. 초기 발병 시기에 충분히 치료를 받는 것이 필요하다.

상대적으로 이른 나이에 발병한 경우 우울증의 경과가 좀 더 안 좋다. 이른 나이에 발병한 경우 보통 유전적인 소인을 가지고 있다고 볼 수 있으며, 뇌 자체가 우울증에 더 취약한 기질을 가지고 있을 가능성이 있다. 우울증은 보통 18세에서 29세 사이에 발병하고, 평균 연령은 30세에서 40세 정도다. 학생 시절부터 10대 초중반부터 우울증을 앓고 있다면 더욱 주의 깊게 살펴봐야 하며, 제대로 치료를 받아야 한다. 이 나이대에 친구들도 트라우마 같은 것들을 안고 있는 경우가 많고, 그래서 예후가 안 좋아질 가능성이 크다. 그러나 그렇다고 해서 꼭 안 좋은 방향으로 흘러가리라 생각할 필요는 없으며, 경각심을 가지고 충분히 치료받는 것이 중요하다.

마지막으로 남성인 경우를 들 수 있다. 남성의 경우 우울증 발병 비율이 여성에 비해 낮지만, 남성이 더 안 좋은 예후인자인 이유는 극단적인 선택을 할 때 위험한 방법을 선택하는 경향이 높기 때문이다. 극단적인 선택을 시도하는 비율은 여성이 더 높지만, 성공해 죽음에 이르게 되는 비율은 남성이 더 높다. 그래서 남성을 안 좋은 예후인자로 보고 있다. 

오늘은 우울증의 경과와 안 좋은 예후를 가진 요인들에 대해 알아보았다. 이 말씀이 평소에 갖고 계셨던 궁금증을 해소하는 데 좋았으면 한다. 추가적인 궁금증이 있으시면 다음 영상에 반영하여 준비하겠다."
https://www.youtube.com/watch?v=cLMlLYsdp3g,"아무 이유 없이 우울하다면, '이것'이 원인일 수 있습니다!","워낙 오래되다 보니까 닭이 먼저인지 달걀이 먼저인지 알 수 없는 것처럼 기분이 가라앉아서 세상을 이렇게 바라보게 됐는지, 아니면 내가 세상을 이렇게 바라봐서 우울하게 된 건지 감별할 수 없을 때가 많은 것 같습니다. 오늘 방송에서는 지난번 지속성 우울장애 편에서 말씀드렸던 대로 어떤 성격적 특성을 가진 분들이 이렇게 오랫동안 우울증을 앓게 되는지에 대해 말씀드리려고 합니다. 

사실 이 성격장애 중 하나인 우울성 성격장애가 있었던 것 여러분들은 잘 모르실 텐데요. 이 진단명은 정신과에서 사용되는 진단 기준 DSM에 원래 등재되어 있었습니다. 1판, 2판까지는 존재했으나 3판부터 빠지게 되었고, 4판에서는 다시 등장했지만 정식 진단에는 포함되지 않고 추가적인 연구가 필요한 진단 파트에 수록되어 있습니다. 어쨌든 이 우울성 성격장애가 존재했었고 지금도 어느 정도 고려할 부분이라 생각할 수 있습니다.

이제 우울성 성격장애의 기준을 살펴보겠습니다. 성격은 여러 가지 상황에서 내가 어떻게 받아들이고, 그래서 어떻게 느끼고 행동하는지를 포괄하는 개념입니다. 우울성 인격장애는 성인 초기부터 다양한 상황에서 발생하는 우울한 인지와 행동의 만연한 패턴으로 정의되며, 총 7가지 진단 기준 중 5가지 이상이 대부분의 날에 최소 2년 동안 지속될 때 진단됩니다. 

첫 번째 기준은 평소의 기분이 우울하고 낙담하는 것이 지배적이라는 것입니다. 나머지 기준들은 사고 방식이나 세상을 바라보는 태도와 관련이 있습니다. 특히 자신을 부정적이고 무가치하게 보는 인식이 포함되어 있습니다. 또한, 스스로를 비판적이고 자기 비난적으로 바라보면서 죄책감이나 후회의 감정을 느끼기 쉽습니다. 따라서 스스로를 부정적으로 바라보는 동시에 세상에 대한 시각도 부정적입니다. 추가적으로 불안과 걱정에 쉽게 빠지며, 다른 사람에 대해 판단적이고 비판적인 태도를 가지며 미래에 대해 비관적인 경향이 있습니다. 

우울은 세상이 이렇게 보이는 것이 아니라, 세상을 이렇게 보고 나를 보니 우울하다는 것입니다. 기분의 영향을 받아 왜곡된 것이 아니라 처음부터 기본적인 사고방식이 부정적인 분들로 볼 수 있습니다. 사실 이런 우울성 성격을 가진 분들을 종종 만나게 됩니다. 어떤 분들은 아주 어렸을 때부터 우울하다고 말씀하시는데, 이는 우울성 성격 개념과 관련이 깊습니다. 

우울장애는 기분장애로, 기분이 우울해지면서 생각이 부정적으로 바뀌는 것이고, 우울성 성격장애는 처음부터 사고 방식이 부정적이어서 2차적으로 우울해지는 것입니다. 이는 성격장애로 분류될 수 있으며 구분하는 것이 쉽지 않아 진단이 애매한 경향이 있습니다. 

주위에서 그런 분들의 발언을 들을 때, 그들이 겪는 어려움이 어떤 성격적 기질에서 기인한 것인지에 대한 고민을 하게 됩니다. 집에서의 경험이나 부모와의 관계 등이 그들의 사고방식과 세상 바라보는 시각에 영향을 주기도 합니다. 

우울성 성격장애는 지속성 우울장애와 겹치는 경우가 많으며, 이 진단이 정식에서 빠진 이유는 두 가지 혼재된 경우가 있어 세밀히 구분하기가 어렵기 때문입니다. 또 다른 성격장애와 특성이 공유되기도 합니다. 

우울성 성격장애에서 낳는 우울증은 약물치료만으로는 제한이 있습니다. 이런 성격적 특성에 대해 이해하고 훈련하는 것이 근본적으로 우울증의 원인을 제거하는 데 도움이 됩니다. 심리치료나 상담이 필수적이며, 이를 통해 자신을 부정적으로 바라보는 시각을 교정하는 연습이 필요합니다. 

단기적으로 변화가 없더라도, 꾸준한 노력은 변화를 일으킬 수 있을 것입니다. 각자의 기질이 다르다는 것도 인지할 필요가 있습니다. 치료를 통해 회복을 위한 도움을 받는 것이 중요합니다."
