video_url,title,summary
https://www.youtube.com/watch?v=tQ2l3DBic0I,[2020] 내년을 받아들일 준비가 안됐어요,"시간이 왜 이렇게 빠르게 흐를까요? 내년을 받아들일 준비가 안 됐는데요. 연말, 새해에 나는 뭔가 해야 할 것 같고, 올 한 해를 돌아보면서 아무것도 한 것도 없이 지나갔구나, 그러면 내년에 꼭 뭔가 해야지? 하는 압박감과 부담감이 커집니다. 그런데 이런 얘기를 하는 환자분들이 꽤 있는데, 왜 연말에 뭔가를 완료해야 한다고 생각하는 걸까요? 새로운 해가 시작되니까 되돌아봤을 때 발전한 게 없는 것 같은 기분이 드는 것 같습니다. 이게 포인트인 것 같아요. 사실 발전이라는 것은 꼭 1년 단위로 일어나는 것은 아닙니다. 우리의 인생은 1년 안에 눈으로 확인할 수 있는 변화가 일어나지 않을 가능성이 높습니다. 그런데 연말이 되면 이를 지표로 확인하고 싶어 하고, 확인할 수 없을 경우 좌절감을 느끼는 것 같습니다. 또 할 수 없는 것이 있으면 내년이라는 기회가 온다고 생각할 수도 있지만, 아무것도 하지 않고 한 해가 다 간 것 같은 허탈감이 이런 이유에서 오는 것 같습니다. 특히 크리스마스에 혼자 있으면 이러한 감정이 더욱 밀려옵니다. 인생은 우리가 예측할 수 없이 계속 흐르고, 사실 해라는 것은 인위적인 기준일 뿐, 내 인생에서 반드시 터닝포인트로 작용할 수는 없습니다. 그렇죠. 그런데 우리는 인위적으로 해가 바뀐다고 정한 시점에서 뭔가 이뤄내지 않으면 제대로 살지 못했다고 느끼곤 합니다. 또 한 해를 완수하지 못했다는 것에 대해 그렇게 생각할 필요는 없습니다. 내 인생의 계획은 내년에 이루어질 수도 있습니다. 그러나 하루하루의 의미는 쌓여가고 있다는 점은 정말 맞는 말입니다. 괜찮습니다. 단순히 무탈하게 하루를 보내는 것만으로도 사실 성장하고 있습니다. 연초에 세운 버킷리스트는 대실패였네요. 실패라고 느낄 수도 있지만, 버킷리스트를 세우는 것은 의미가 있습니다. 내가 인생에서 중요하게 생각하는 것이나 올해 당장 필요한 일을 정리하는 것은 매우 의미가 있습니다. 그런 맥락에서 연초나 연말은 어떤 완수를 위한 것이 아니라, 한 해를 돌아볼 수 있는 체크 포인트라고 생각했으면 좋겠습니다. 매년 연초에 계획을 세우지만, 올 한 해 완수하지 못했다고 해서 매년 같은 계획을 세웁니다. 그러나 시간이 흐르면서 보면 전체적으로는 조금씩 목표에 가까워지고 있다는 것을 느낍니다. 올해 안에는 이루지 못했지만, 작년보다 목표에 조금 더 다가갔습니다. 결국 언젠가는 이루어질 것입니다. 방향성을 세우는 것은 정말 중요하고 의미가 있지만, 내가 원하는 시점에 그것을 꼭 달성해야 한다는 것은 아닙니다. 내년에는 올해보다 꼭 행복해질 것입니다. 반드시 행복할 것입니다. 행복에 대한 강박은 안 됩니다. 그렇다고 행복을 추구하는 것이 나쁘다고 생각할 수도 없습니다. 어떤 기준을 정해놓고 그것을 행복이라고 생각하는 것이 문제인 것 같습니다. 요즘 말하는 긍정 심리학이나 긍정 상태라는 것도, 항상 내가 원하는 좋은 일들만이 일어나는 것이 긍정이 아닙니다. 나에게도 나쁜 일이 일어날 수 있고, 사고가 일어날 수도 있으며, 원하는 방향으로 인생이 흐르지 않을 수도 있습니다. 그럼에도 불구하고 나는 내 인생을 소중히 여기고, 소중한 사람들과 살아가고 있습니다. 이것이 우리가 긍정 마인드라고 부르는 것입니다. 행복해야 한다는 압박을 느끼지 않아도 됩니다. 내가 지금 부족하다고 해서 더 가져야 행복해진다는 기준을 세우지 않으셨으면 합니다. 중요한 말입니다. 저는 2019년 가장 행복한 일이 나와의 만남이었습니다. 좋은 친구 한 사람과의 만남도 인생에서 정말 큰 행복인 것 같습니다. 힘든 시기에도 이렇게 힘든 이야기를 나누고 대화를 통해 극복할 수 있다는 것이 좋은 사람들을 만나려는 바람입니다. 오늘 이야기는 어땠나요? 올해 따뜻한 기억 하나쯤은 분명 있으실 겁니다. 그래서 따뜻한 마음으로 하루, 한 해를 마무리하시고 내년에 또 다른 기회가 찾아오기를 바랍니다. 지금 그대로도 충분히 아름답고 행복하다는 마음으로 내년에 또 만나요."
https://www.youtube.com/watch?v=8Wkai3h-t8s,[크리스마스] 뭔가 해야될 것만 같다면 보세요,"이번 주는 조금 더 빨리 찾아왔네요. 이제 곧 크리스마스인데, 정말 더 이상 혼자 있기는 싫은데, 또 이 시기에 더 쓸쓸해하는 우리 친구들을 위해 저희도 더 따뜻한 세트를 꾸며봤습니다. 따뜻해 보이나요? 저도 혼자 있기엔 쓸쓸해서 오늘은 제 친구를 한번 불러봤어요. 궁금하시죠? 이정미 씨라고, 정미라는 제 친구인데요. 혜란이라는 친구와 모임에서 알게 됐고, 그 후에는 상담실에서 선생님과 환자로 만났어요. 그때 솔직하게 이야기를 나누면서 가까워졌습니다. 멀쩡해 보이지만 속은 여린 정미와 함께 이야기해보겠습니다.

크리스마스 때 뭐 하실 거예요? 저는 가족과 함께 특별한 약속은 없고요. 가족이 있어도 외롭지 않나요, 크리스마스 때? 옆에 누군가가 있긴 한데, 뭔가 허수아비 같은 존재? 투명인간 같은 존재? 한 분이 계신데, 크리스마스 때 꼭 행복해야 하는 건 아니잖아요? 왜 나만 외로움을 느낄까요? 크리스마스는 왜 항상 이렇게 쓸쓸했는지에 대한 이야기를 나눠보겠습니다.

친구들이 보낸 고민들을 함께 이야기해볼까요? 다른 사람들은 다 행복해 보이는데, 제 처지는 왜 이렇게 초라할까요? 크리스마스 연휴에 약속이 없는 분들이 많아요. 생각보다 크리스마스에 약속을 갖기란 어렵죠. 크리스마스는 우리 삶에서 특별한 날일 뿐인데, 그 날에 나에게 어떤 의미를 갖게 하려는 강박이 생기기도 해요. 그러다 보니 집에 있으면 바보처럼 느껴지기도 하고, 자존감이 떨어지기도 하죠. 행복하라고 만든 시즌인데, 오히려 남의 행복을 부각시키면서 더 불행해지는 것 같아요.

크리스마스 때 인스타그램을 보면, 행복한 사람들의 모습만 부각되잖아요. 행복한 사람들만 자랑하고, 집에 있는 사람들은 그걸 올리지 않기 때문에, 나만 외로운 게 아니고 사실은 다 똑같이 그런 상태라는 거죠. 크리스마스에는 우리 머릿속에 집단적으로 갖고 있는 행복에 대한 강박이 더 커지는 시즌이기 때문에, 이를 견디기 어려운 것 같습니다. 

작년 이맘때쯤 헤어졌는데, 요즘 자주 생각나요. 남자를 추억할 사람이 없다는 것도 슬프죠. 아무도 기억할 남자가 없고, 그마저도 슬픈 건가요? 추억이 있는 걸 슬프게 느끼기도 하죠. 슬픈 영화 보고 나면 아릿한 마음이 드는 것처럼, 그런 아릿한 추억이 있는 건 사실 삶에서 좋은 것 같아요. 그런 기억이 없는 것보다 아픈 추억이나 좋은 추억이 더 나은 것 아니겠어요? 결국 인간은 지나고 나면 남는 건 추억뿐이죠.

롱디 커플의 크리스마스는 어떻게 보내면 좋을까요? 평일 같았으면 중간에 쉬었을텐데요, 오히려 크리스마스는 사람들을 서운하게 만들기도 하죠. 이날은 꼭 붙어 있어야 하고, 그 의미가 중요하다고 생각하니까, 커플들이 의외로 싸우기도 쉬운 날일 것 같아요. 크리스마스에 대한 기대가 너무 크기 때문에 실망하게 되는 경우가 많죠. 

사실 크리스마스라고 해서 남자친구나 여자친구가 크게 변하는 건 아니잖아요. 그런데도 거기에 미치지 못할 때 실망하고 좌절하게 되는 이유가 되겠죠. 현실에서 산타가 없는 것처럼, 자꾸 그런 기대를 하다 보니 오히려 상처를 받는 것 같습니다. 연말에 뭔가를 완수해야 한다고 생각하는데, 돌아보면 나는 발전이 없는 것 같고, 한 해를 제대로 살지 못한 것 같다 느끼기 쉽죠. 하지만 그렇게 생각할 필요는 없어요."
https://www.youtube.com/watch?v=5kHR8Pz42SU,몇 살쯤 되면 불안하지 않을까｜진로고민 & 외로움 & 학업스트레스 고민상담,"저는 18세입니다. 어리고 아무것도 모른다고 생각하는 사람들이 많아서 꼭 참고 살았는데, 사실 성인이 되는 것이 너무 겁이 납니다. 무서운 현실이 다가오니까 도망가고 싶다는 생각을 해요. 여기서 도망은 자살을 뜻하는 표현입니다. 엄마는 아빠에게 폭언과 폭력을 당하면서도 간신히 버티며 저를 키워주셨어요. 엄마 때문에라도 간신히 살고 있는 것 같습니다. 언제일지는 모르겠지만 스무 살이 되기 전에는 도망가고 싶다는 생각을 하고 있어요. 진짜 저는 어떻게 해야 할까요? 당장 오늘을 넘길 수 있을지도 잘 모르겠어요.

고민 사연을 고등학교 2학년 여자분이 보내주셨는데요. 어른이 되는 게 두려우시대요. 아직 잘하는 것도 없는데 성인의 이름을 갖는 것이 너무 겁이 나고, 가정환경이 아주 편안하지 않았던 것 같습니다. 도망가고 싶은데, 도망간다는 것은 자살을 생각하게 만든다고 하셨어요. 스무 살이 되기 전에 죽어버리자는 생각을 하고 계신 것 같아요. 우선 이 친구 상태가 걱정됩니다. 자살을 생각하는 것은 일반적이지 않죠. 저한테 오는 학생들도 이런 문제로 힘들어하는 친구들이 많은데요. 그 이유는 이 시기가 감정이 풍부하기 때문입니다. 물론 항상 감정이 밝고 풍부하다면 좋겠지만, 힘든 친구들도 많습니다. 그러나 제가 더 나이를 먹은 입장에서 보면 18, 19, 20세는 말만 성인일 뿐입니다. 아직 많은 것을 갖추지 못하는 것이 당연하고, 잘하지 못하는 것도 너무 정상입니다. 저도 잘하겠습니까? 40, 50, 60세가 되어도 정말 많은 것을 알고 다 잘할까요? 절대 그렇지 않습니다. 심리학 이론에 따르면 발달은 몸이 아닌 마음의 발달이라고 합니다. 마음의 발달은 끝나는 것이 아니라 죽을 때까지 계속된다고 해요. 어렸을 때 사회생활을 배우고 중고등학교 시기에 마음이 커져서 어른이 된다고 하지만, 어른이 되는 시점은 내가 나를 아는 정도에 불과합니다. 자기 자신에 대해 아는 것도 사실 20세에 완성하기는 어려운 것 같습니다. 20세라는 나이는 법적인 것이지 마음이 성숙할 수 있는 나이는 아닙니다. 내가 나를 알면 그 다음 단계로는 진정한 관계를 맺는 것입니다. 내가 어떤 사람인지 알아야 관계를 맺을 수 있고, 관계를 맺고 나면 사실 그 다음 단계로 가족이나 주변 사람을 챙기고 사회에서 역할을 하는 이상적인 발달 단계가 있습니다. 나이가 정해져 있는 것이 아니기 때문에, 마음의 성장 속도는 사람마다 다르며, 친구들과 비교하며 걱정하지 말라는 것입니다. 여러분의 마음은 죽을 때까지 성장할 것입니다.

안타까운 것은 이 친구가 부모님이 조금 더 따뜻한 환경을 제공했다면 이런 고민을 덜 했을 것이라는 점입니다. 이러한 보듬어줄 사람이 부족해 본인이 자꾸 고민을 더 깊이 파고드는 것 같기도 해요. 여튼 이 정도 나이에 고민하는 것은 너무 자연스러운 일입니다. 모든 것을 다 갖추고 나이 들면 무엇을 할 것인가요? 마음이 자라날 시간이 필요합니다. 

미국에서 공부 중인 대학생입니다. 학기 중이지만 여전히 손에 잡히는 것도 없이 초조하고, 헛헛한 마음이 자주 듭니다. 혼자라는 생각이 뚜렷해질 때마다 이대로 사라져도 상관없다는 생각을 해요. 가족이 아니라면요. 요즘은 잠을 자다가 한두 번 이상 깨고, 자주 화장실도 가고 폭식도 합니다. 자주 멍해지는 기분이 드는 것도 걱정입니다. 한국에 돌아가도 이럴까 봐 우려됩니다. 제가 어느 정도인지 알고 싶습니다. 운동을 열심히 하면 괜찮아질까요?

다음 사연은 유학생의 사연입니다. 미국 유학생들이 고민하는 일이 많죠. 병원 가기가 쉽지 않고, 비용도 많이 들며 정신과를 찾기가 쉽지 않습니다. 유학생활이 좋다고 해도 혼자 지내는 것은 쉽지 않을 겁니다. 외롭기도 하고 친구가 정신 건강에 대해 물어보면, 실질적으로는 우울증 경증일 수 있습니다. 자신에 대해 생각해볼 정도이니까요. 자주 깨고 화장실도 자주 가는 등 사인들이 있었어요. 폭식은 심리적인 허기짐의 표현입니다. 스트레스를 받을 때 많이 먹는 이유입니다. 경증 우울증은 자신이 잘 관리하면 치료가 가능하니 운동을 많이 추천합니다. 특히 외국에서는 운동 환경이 좋으므로 꾸준히 하면 경증 우울증을 극복할 수 있습니다. 낮에 햇볕을 많이 쬐고 조금 노력하면 생각보다 개운해질 것입니다. 정신이 실제로 회복되니까요. 유학생들이 자주 겪는 어려움이며, 힘든 상황에 있다면 좋은 해결책을 찾으시길 바랍니다. 운동을 하고, 친구와 연락하며 사람들과의 만남을 늘리면 좋을 것 같습니다.

저는 초등학교 4학년 때 시험을 망친 후로 공부에 집착하게 됐습니다. 공부를 너무 많이 해서 아빠가 혼낸 적도 있습니다. 어느 날 공부하다가 갑자기 숨을 헐떡이며 울었던 적도 있습니다. 대학교에 가면 조금 느슨하게 공부할 줄 알았지만 아직도 강박에 사로잡혀 공부하고 있습니다. 지쳐서 시험 하루 전에 공부를 못하게 되면 불안해서 손등을 손톱으로 찢습니다. 어제도 그랬습니다. 장학금 때문이고, 이것도 장려 콤플렉스 때문인 것 같습니다. 어렸을 때부터 집이 가난하다는 얘기를 많이 들었습니다. 남들보다 뒤처진 것 같고 자존감이 많이 낮아져서 막막합니다. 이런 이유로 연애에 집착하게 되는 것 같습니다. 남자친구가 없으면 너무 불안합니다. 제가 괜찮은 것일까요?

초등학교 4학년 때 수학 시험을 망치고 공부에 집착하게 되었다고 하셨군요. 장려 콤플렉스 때문에 잘해야 한다는 강박이 있었던 것 같습니다. 부모님이 열심히 사셨기 때문에 나도 잘해야 한다는 생각이 들 수 있죠. 특히 첫째라면 더욱 그러할 수 있습니다. 자기 문제의 원인을 어느 정도 분석 잘 하신 것 같아요. 많은 사람들이 자기 문제의 원인을 알고 있으면서도 잘 통합하지 못하는 경우가 많습니다. 이 친구는 남의 눈치를 많이 보고 신경 쓰는 성격인 것 같습니다. 남자친구는 유일한 편이라고 생각을 하니 없으면 불안한 것입니다. 그러나 진짜 문제는 자기 자신에 대한 가치입니다. 자신이 부정적인 감정을 느끼고 몸을 해치며 사는 것은 결코 바람직하지 않습니다. 누구나 모든 분야에 뛰어날 수는 없으므로, 하지 못하는 것에 대한 이해가 필요합니다. 자신에 대한 편안한 생각의 시간을 가지는 것이 좋습니다.

유학 생활 중 외롭고 적응하기 어려운 경우가 많습니다. 고민을 털어놓으시고 있을 때, 혼자서 끙끙 앓지 말고 저희 대숲정신과에 방문해 주세요."
https://www.youtube.com/watch?v=TteW-FeZQ8M,소모적인 인간관계에 지쳐버린 당신에게,"전체 내용을 검토하고 문법 및 오타를 수정했습니다. 구독, 좋아요, 알림 설정 및 댓글 관련 내용은 제거하였고, 인삿말을 모두 삭제했습니다. 내용이 잘 정리되었는지 확인했습니다.

---

누군가와 관계가 망가지는 게 두려워 모든 사람에게 착한 사람이 되려고 합니다. 마치 저는 중요하지 않은 사람처럼 행동합니다. 나를 미워하는 사람이 있으면 그 사람이 옮길 말들이 무섭고, 그 사람 때문에 내 평가가 저하될까 봐 두려워요. 그래서 누군가와의 연애도 쉽사리 시작하지 못하고 있습니다. 나도 내 자신이 소중한 사람인데, 남의 평가에 전전긍긍하며 사는 내가 너무 미워요. 모든 사람에게 착한 사람이 되려 하는데, 이것이 착한 아이 증후군, 착한 여자 증후군, 착한 딸 증후군, 착한 자식 증후군 같은 것이죠. 이렇게 생각보다 많습니다. 또 왜 그럴까요? 상대방이 떠나갈까 봐? 힘들까 봐? 두려워서? 관계가 망쳐버릴까 봐 그렇습니다. 하지만 관계는 결국 쌍방입니다. 여러 명이 있을 수 있지만, 내가 혼자 잘한다고 해서 절대로 좋은 관계가 이루어지지 않아요. 그 생각을 우선적으로 정리해야 합니다. 내가 잘하면 그 사람이 나에게 잘해줘야 한다고 생각해서는 안 됩니다. 내가 무조건 맞춰준다고 해서 그 사람이 나를 떠나지 않는 것은 아니거든요. 그 신경을 쓰는 게 생각보다 상대방에게 다 전달됩니다. 인간관계라는 것이 매우 상대적이기 때문입니다. 사람들은 이기적입니다. 따라서 어느 정도의 수평을 맞춰주는 것이 건강한 관계에서는 매우 필요합니다. 그렇게 하면 더 오래 갈 수 있습니다. 그렇게 되면 상대방이 나에게 더 떠나지 않을 수 있어요. 상대방은 내가 관계에 얼마나 마음을 쏟고 있는지를 압니다. 인간은 누구나 이기적이기 때문에 그걸 이용하기 쉽습니다. 내가 관계를 잘 유지하고 싶다면, 내가 원하는 것에 대해 어느 정도 명확하게 지분을 가져야 합니다. 관계의 지분을 갖는 것이 건강한 관계를 유지하는 데 아주 중요합니다. 나는 관계에 상처받고 싶지 않고, 관계가 어그러지는 걸 원하지 않으며, 상대방이 떠나는 걸 원하지 않습니다. 그러려면 내 지분을 가져야 합니다. 눈치 보는 것 자체가 오히려 관계를 망칠 수 있습니다. 

저는 동성애자입니다. 친한 친구들에게 커밍아웃을 했는데 다행히 반응이 좋았습니다. 그런데 커밍아웃을 하고 나면 마냥 후련할 줄 알았는데, 어느새 제가 눈치를 보고 있더라고요. 마음이 복잡하고 계속 불안하며 부정적인 생각들을 하게 됩니다. 친구에게도 가족에게도 말하기 어려웠고, 병원에 가기엔 더 무섭고 부담스러웠습니다. 이야기할 곳이 없네요. 이번 사연은 24살 남자 대학생입니다. 동성애자라고 소개해 주셨고, 10년째 친한 친구들에게 동성애자라고 커밍아웃하셨다고 합니다. 말씀하신 대로 말하고 나면 후련할 줄 알았는데, 그 뒤로 계속 눈치를 보고 있다고 합니다. 여전히 가족이나 주변 사람들에게 이야기를 못하는 경우가 많으며, 이것 때문에 스트레스를 받는 분들도 많습니다. 이것이 정말로 원하는 일이지만, 사회적으로는 감당하기 어려운 일들이 함께 옵니다. 비유하자면 저는 버스 운전사입니다. 고속버스를 몰고 가고 있는데, 원하지 않는 사람들이 타고 있습니다. 저는 이 버스를 몰고 원하는 목적지로 가야 합니다. 그런데 버스에 사람들을 태웠는데 나가지 않으니, 어떤 사람은 너무 시끄럽고 어떤 사람은 발로 저를 차고요. 그러면 어떻게 할까요? 버스에서 내려 그냥 안 간다고 할 수도 있지만, 저는 여전히 원하는 목적지까지 가야 하니까 참고 가자고 스스로를 설득할 수 있습니다. 내가 정말 원하는 것을 다른 것 때문에 놓치느냐 아니면 그냥 받아들이며 안고 가느냐는 사실 한 끗 차이일 수도 있습니다. 이 다른 이유들 때문에 내가 원하는 것을 포기하는 것은 어리석은 일이에요. 조금 비유가 다를 수 있지만, 어쨌든 동성애라는 건 아직 많은 사람들에게 이야기하기 어려운 일이 될 수 있습니다. 물론 그런 부분이 있지만, 내가 감당해야 할 부분이라면 그냥 안고 가세요. 어차피 안고 갈 거라면, 뒤에 사람들보다는 내가 운전하는 데 집중하고 아름다운 경치도 감상하며 가는 것이 더 좋습니다. 

인간관계가 이렇게 힘든 건가요? 10년 가까이 든 친구와의 관계를 끊고, 정말 좋아했던 남자친구와 며칠 전 이별했습니다. 잠을 자도 3번은 깨고, 꿈에선 자꾸 10년 지기 친구나 전남친이 나옵니다. 아침에 눈을 뜨면 심장이 너무 크게 뛰고, 두근거림이 일상에서 반복됩니다. 사람에게 지쳐서인지 모든 연락을 피하고 사람들을 만나기도 힘듭니다. 아는 사람과 마주치기 싫어 눈치 보며 걷게 됩니다. 이런 감정이 쌓이다 보니 많이 지쳤나 봐요. 그동안 밝게 다니던 제 모습이 아닌 것 같아요. 극복할 수 있을까요? 다음 사연은 권태기에 관한 이야기입니다. 저는 권태기만 알았지 최근에 권태기가 관계 때문에 올 수 있다는 걸 알게 됐습니다. 고민을 보내신 분은 10년 가까이 된 친구와 최근에 연을 끊으셨습니다. 어떤 이유 때문인지 궁금합니다. 여기에 정말 좋아했던 남자친구와 며칠 전 이별하셨다고 합니다. 꿈에 그 친구나 전 남자친구가 나오는 게 너무 힘든 것 같습니다. 아침에 일어나면 심장이 너무 크게 뛰고 가슴이 두근거린다고 합니다. 꿈에서 느끼는 감정이나 이런 것들이 실제로 다 겪는 것이기 때문에, 꿈에서 겪은 일이 낮에 겪는 것과 동일합니다. 꿈에서 화가 나면 심장이 빨리 뛰고, 슬퍼서 울기도 합니다. 그런데 왜 눈물이 나지 않을까요? 근육이 마비되어 울음을 못 우는 것이죠. 마음으로 울고 있는 것입니다. 이 친구는 밤마다 많이 울고 있는 것 같습니다. 사실 이분은 항상 밝고 친절하게 보이려 하며 불편한 사람들에게도 좋은 인상을 주어야 한다고 생각했던 것 같습니다. 지칠 만합니다. 사람은 신이 아닙니다. 감정이라는 것은 항상 좋을 수는 없습니다. 몸도 마찬가지입니다. 하루에 쓸 수 있는 에너지는 한계가 있죠. 헬스장에서 한 시간 운동도 힘든데, 하루에 주어진 에너지는 한계가 있습니다. 감정도 똑같습니다. 그런데 자꾸 에너지를 감정을 밝게 쓰다 보면, 중요한 곳에서 감정을 제대로 쓸 수 없습니다. 결국 중요한 게 무엇인지 정리해야 합니다. 우선 내 마음이 어떤지를 알고 잘 다스리는 것이 중요하고, 그다음에는 정말 소중한 사람들을 챙겨야 합니다. 하지만 다른 내 감정을 다 써버리니까 허덕일 수밖에 없습니다. 나중에는 고갈됩니다. 지쳐서 나가 떨어지는 것이죠. 이런 걸 생각하다 보면 굳이 착한 사람이나 밝은 사람이 되려고 노력할 필요는 없습니다. 에너지가 10이 있다면 그중 반은 반드시 나에게 먼저 써야 합니다. 그리고 그 반은 정말 사랑하거나 중요한 사람에게 쓰고, 남는 에너지가 있으면 다른 사람에게 나누면 됩니다. 모두 잘해주고 싶지만, 우선은 이런 순서가 더 좋을 것 같습니다."
