video_url,title,summary
https://www.youtube.com/watch?v=rg6tXTNca-4,우울증에 더 잘 걸리는 사람들의 소름돋는 공통점 1가지 (최명기 원장 / 4부),"진짜 죄송하지만 뇌예요. 왜냐하면 우리는 모두 괴롭고 슬픈 일이 있으면 진단 기준에 해당되는 우울증에 걸릴 것 같지요? 크게 잡았을 때 병원에서 치료를 요하는 2주 이상의 우울증을 겪는 분은 보통 10명 중 3명 정도라고 생각해요. 굉장히 높게 잡았을 때. 어떤 분의 유전자 속에는 우울증이 생길 가능성이 높은 유전자가 있어요. 특히 우울증에 더 잘 걸리는 사람들의 특징은 무엇인가요? 사실 별로 없어요. 외향적인 사람은 우울증에 걸리지 않을 것이라는 선입견이 있기 때문이죠. 그래서 유명인이 자살하게 되면 사람들은 ""그럴 줄 몰랐어요""라는 이야기를 해요. 그러나 외향적이더라도 그분들은 보통 괜찮을 때만 사람을 만나요. 외향적이고 활발한 사람이 혼자 있을 때는 어떨지 알 수가 없어요. 그리고 외향적이고 활발한 분들은 우울증에 걸리게 되면 혼자 있는 것을 더 무서워해 더 많은 사람들을 만나요. 그래서 외향적인 사람이라고 해서 우울증에 더 걸리는 게 아니에요. 반대로 내향적인 사람이라고 해서 우울증에 더 걸리는 것도 아닙니다. 내향적인 사람들은 혼자 있기를 좋아하는 경우가 많고, 그래서 혼자 있고 사람들을 만나지 않아서, 주변에서 보면 그들이 굉장히 행복하게 게임도 하고, 오락도 하고, 책도 읽고, 즐겁게 지내는 것처럼 보이지만 실제로는 우울해 보일 수 있어요. 말수가 적으면 더욱 그렇고요. 그렇기 때문에 우울증에 걸리는 특정 성격이나 요인은 별로 없어요. 그러나 몇 가지 우울증에 잘 걸리게 하는 요소는 분명히 있습니다. 첫 번째로, 알코올 중독이나 약물 중독이 우울증에 잘 걸리는 경향이 있습니다. 왜냐하면 보통 우울증은 6개월에서 1년 정도 지나면 나아지는데, 알코올 중독인 경우 우울증에 걸린 상태에서도 술을 멈추지 못하게 되므로 우울증이 지속되는 경우가 많아요. 또한 술은 사람을 우울하게 만들기 때문에 알코올에 의존도가 높고, 일상생활에 방해를 받는 분들은 우울증에 걸릴 가능성이 매우 높습니다. 두 번째로, 신체적인 질환 역시 우울증을 유발할 확률을 높입니다. 예를 들어 면역과 관련된 요인으로 인해 우울증을 일으킬 수도 있으므로 자가 면역 질환이 있는 경우 우울증에 걸릴 확률이 높아집니다. 만약 어떤 분이 너무 아파서 제대로 먹지 못한다면, 결국 우울증에 걸릴 수밖에 없을 것입니다. 그런 경우에는 영향을 많이 받게 됩니다. 그 다음은 불행입니다. 예를 들어 올해 나는 그저 사는 게 별로 재미없다는 가벼운 우울증에 걸릴 수도 있어요. 그러나 그때 불행이 겹치게 되면 그 우울증은 상당히 깊고 길게 가게 됩니다. 그렇기 때문에 불행은 우울증을 더 심하게 할 확률이 높고, 불행에 빠질 확률이 높은 분들은 결국 충동적이고 극단적인 성공과 행복을 꿈꿀수록 실패하면서 극도의 불행에 빠질 가능성이 존재합니다. 그러므로 극단적인 행복과 성공을 꿈꿀수록 우울증에 걸릴 확률이 역설적으로 올라가게 됩니다. 

우울증 자가진단법이 있다면 가장 널리 사용되는 점수 측정 방법이 있습니다. 서울시에서 하든 보건소에서 하든, 학교에서 제공하든 대부분 다 유효합니다. 어떤 방법을 사용하든지 우울증이라고 나오면 자신이 현재 우울증일 가능성이 있습니다. 하지만 우울증을 자각하는 데 가장 방해되는 것은 우울증이라는 진단명 자체입니다. 원래 우울증은 영어로 'depression'인데, 이는 '푹 꺼지는 것'을 의미합니다. 그러나 내가 무기력하고 기운이 없으면 내 마음이 행복할 리가 없죠. 우리는 우울증이라고 해놨기 때문에 내 마음이 울고 싶고 죽고 싶을 정도가 되어야지만 우울증이라고 생각해요. 하지만 그런 것이 아닙니다. 행복하지 않으면, 어떤 이보다도 우울한 것입니다. 만약 다른 신체 증상이나 감정이 주가 될 때, ""나는 우울하거나 슬프지 않아""라고 생각하면서 내가 우울증이라는 것을 놓치게 될 수 있습니다. 가장 놓치는 형태의 우울증은 공황발작을 동반하는 것입니다. 공황은 가슴이 두근거리고 숨이 막히고 가슴이 답답하고 구역질이 나거나 어지러울 때 발생하며 일반적으로 몇 분에서 한 시간까지 지속됩니다. 그러면서 잠도 안 오고 무기력하고 집중력도 떨어집니다. 이런 경우에는 우울증의 진단 기준을 다 충족하지만, 이들은 불안하고 힘들기 때문에 자신이 우울증이 아니라고 생각해요. 그래서 우울증의 기준에서 중요한 것은 우울증인데 우울증이 아니라고 생각하는 것을 바로잡는 것입니다. 또 다른 경우로, 대부분의 우울증은 고민과 번민으로 나타납니다. 고민과 번민에 대한 마음의 증상은 아주 낮지만, 몸도 둔하고 아침에 일어나는 것도 힘들 크며 자주 자도 피곤합니다. 사실 불면증이라고 하지만 나는 잠이 늦게 자지만 자는 시간은 늘어나요. 의욕도 없고 집중력도 떨어지며 능력치가 떨어져서 제대로 하는 것이 없는 것 같아요. 그러나 이분들도 본인을 우울증이라고 생각하지 않습니다. 본인은 무기력하다고 생각하면서 우울하고 슬퍼지지 않겠다고 생각하게 되는 것이죠. 따라서 만약 2주 이상 나의 컨디션이 다운되고 평소와 같지 않은 상태가 지속되며 내과적인 질환으로 설명할 수 없다면, 즉 좌절감, 분노, 짜증, 무기력, 피곤함, 집중력 저하 및 과도한 수면이나 불면증, 체중 변화와 같은 증상이 2주 이상 지속된다면, 나는 우울하지 않은 우울증이라고 생각해야 합니다. '디프레이션'에 해당하는 경우입니다. 하지만 한국어로 번역된 '우울증'이라는 말 때문에 사실은 자신이 디프레이션 상태임에도 불구하고 치료를 받지 않게 되는 경우가 많습니다. 우울증에 빠지는 가장 큰 원인은 무엇인가요? 진짜 죄송하지만 뇌입니다. 우리는 모두 괴롭고 슬픈 일이 있으면 진단 기준에 해당되는 우울증에 걸릴 것 같지요? 크게 잡았을 때 병원에서 치료를 요하는 2주 이상의 우울증을 겪는 분은 보통 10명 중 3명 정도라고 생각합니다. 정말로 미안하지만, 10명 중 7명은 삶에서 고통과 고민이 오더라도 며칠 잠 못 자고 괴롭지만 두 달, 세 달 동안 우울증으로 가지는 않습니다. 슬픈 일이죠. 어떤 분의 유전자 속에는 우울증이 생길 가능성이 높은 유전자가 있습니다. 진짜 미안해요, 하지만 그렇다고 해서 슬퍼할 일은 아닙니다. 여기 이야기하고 있는 의사도 우울증을 앓고 있기 때문입니다. 너무 슬퍼하지 마세요. 약을 복용하며 잘 지내고 있습니다. 또 슬퍼하지 않아야 할 이유가 있습니다. 우리의 유전자는 완벽한 조합으로 이루어진 것이 아니기 때문입니다. 모두를 완벽하게 채울 수는 없습니다. 나는 우울증에 잘 걸리는 뇌를 가지고 있지만, 상대방은 빨리 죽는 몸을 가지고 있을 수도 있습니다. 따라서 나는 우울증에 걸렸을 때 3, 4년에 한 번 치료를 받고, 6개월에서 1년 동안 힘들기도 합니다. 그런 상황은 나를 괴롭히고, 행복할 때도 불행할 때도 발생하지만, 반대로 다른 사람들도 저마다의 어려움을 지니고 있습니다. 우울증에 걸릴 가능성이 있는 유전자와 30세에 폐암에 걸리는 유전자 사이에서 어느 쪽을 선택하시겠어요? 둘 다 선택하고 싶지 않겠죠. 하지만 결국 나에게는 우울증에 걸리는 유전자가 있습니다. 그래서 우울증에 걸리면 약을 복용하고 치료를 받아야 하지만, 그렇다고 해서 다른 사람들이 모두 완벽하지 않다는 점을 받아들여야 합니다. 우울증에 걸렸을 때 치료 방법도 내가 선택할 수 있습니다. 우울증은 한 번 왔다가 가기 때문에, 짧게는 몇 달, 길게는 3, 4년, 아주 길게는 10년 동안 나에게 오지 않을 수도 있습니다. 우울증이 완전히 떠나간 시기가 되면 약을 먹든 안 먹든 계속 우울하지 않을 수 있습니다. 이렇게 자꾸 우울한 감정이 생기면 너무 괴롭게 생각할 필요는 없어요. 자신이 우울증이라고 인지했을 때 맞춰서 나의 삶의 태도를 바꿔야 할 때도 있어요. 그런데 어떤 사람은 우울증 일 때 오후 4시 전에 아무것도 못하고 4시 이후에 잘하는 경우도 있습니다. 이렇게 된다면 4시 이전에는 일을 안 하면 되는 거지요. 우울증일 때는 사람들이 아침에 일어나서 햇빛을 보고 산책하라는 것을 자주 말합니다. 그러나 이런 방법은 우울증 환자에게 전혀 도움이 되지 않습니다. 어떤 분은 원래 운동을 좋아해서 우울증이 있더라도 저녁에 운동할 수 있는데, 그런 사람에게는 긍정적인 감정이 생길 것입니다. 그러나 운동을 싫어하는 사람에는 효과가 없겠죠. 이처럼 각자의 상황에서 긍정적인 감정을 유도하려는 노력이 필요합니다. 그렇기 때문에 우울증으로 고생하는 분에게 내가 잘하고 좋아하는 것이 실제로 도움이 될 수도 있지만, 그렇지 않을 수도 있습니다. 우울증 기간 동안에 긍정적인 마음을 유지하기 위해서는 컨디션이 좋은 시간 동안 즐거운 활동을 하는 것이 중요합니다. 대부분은 유튜브 시청이나 게임을 통해 긍정적인 감정을 찾곤 합니다. 

이런 점들을 염두에 두시면서 하루하루를 잘 보내시길 바랍니다."
https://www.youtube.com/watch?v=pMe7cL5RU7M,멘탈관리? 내 마음 이렇게 지키자! / 최명기 정신과전문의 / 서울청년센터 동대문 청학동 1강,"내용을 검토하고 다음과 같이 수정했습니다.

---

Último Profettering 댄했습니다. 테이들로에서 각 사람이 내려갈 수 있는 곳에 있는 사람만이 다른 사람도 내려갈 수 있습니다. 제 이름은 최명기입니다. 여기에서는 비다이어트 명사를 볼 수 있습니다. 이는 정말 흔한 단어입니다. 저와 저의 스트레스는 유타에서 발생하는데, 이는 비현실적으로 보이며, 포치아스와 수 가족과는 다릅니다. 여러 의사에게 관련된 내용을 포함하며, 이 스트레스는 포르헨 교구 온라인에서 불립니다. 이 시점에서 ""스트레스""라는 용어는 저에게 당연한 것이며, 두 가지 결과를 찾기 위해 짧은 시간 내에 많은 용량을 제공해야 합니다. 규제가 있고, 그가 한 일이 보이는 것 같습니다. 그는 계획한 대로 문화에 들어갔다고 하며, 저는 항상 그 사실을 기억하곤 했습니다. 하지만 그들이 믿을 수 있는 모든 것들은 다르게 됩니다. 이와 관련하여, 저는 이혼하고 전 부치었습니다. ""회식은 아무 문제 없다. 낯선 사람과도 잘 이야기한다.""라고 말했습니다. 하지만 제출은 너무 무서워요. 어떤 분들은 발표와 회식 모두가 두렵고, 조금만 일해도 걱정을 많이 하며 인간관계에 대해 고민이 많습니다. 이런 경우 불안형 사람들은 멘탈이 약하다고 부릅니다. 그러나 또 다른 분들도 있습니다. ""지루해서 못 참겠다. 끈기가 없다. 안 해야 한다고 생각하면 바로 중단한다. 화를 참지 못한다."" 이분들도 본인 스스로 멘탈이 약하다고 생각합니다. 왜냐하면 항상 다른 생각이 들어 한 가지에 집중하지 못합니다. 또한 앞에서는 ""멘탈이 겁이 너무 많다.""고 쓰였지만, 이 경우 멘탈은 ""나는 참을성이 없다.""라는 것이 됩니다. 참을성이 없다는 것은 충동성이 강하다는 것을 의미합니다. 

사람은 다양한 면에서 멘탈이 약할 수 있습니다. 겁이 많은 사람은 외부에서 화를 내지 않는 부분에서도 멘탈이 굉장히 강합니다. 모든 사람은 어떤 면에서는 멘탈이 강하고, 다른 면에서는 약합니다. 따라서 '멘탈이 약하다', '멘탈이 강하다'고 하는 표현은 우리가 오늘 강의에서 사용하긴 하지만, 그 표현 자체가 우리의 위축을 초래하는 것입니다. 저의 상담을 받는 분들이 ""저는 너무 예민해요""라고 하면, 저는 ""아닙니다. 어떤 면에서는 예민하지만 다른 면에서는 예민하지 않다""고 말씀드립니다. 예를 들어, 어떤 분은 대개 소음에는 예민하지만 음식에는 무관심한 경우가 있습니다. 우리는 멘탈이 약하다고, 스트레스에 약하다고 이야기할 때 그 영역이 분명해야 문제가 해결되고 자존감이 덜 무너집니다. ""나는 멘탈이 약해""라고 생각할 때, 사실은 내 작은 부분만 나를 불편하게 하는데 그것을 내 인격 전체로 확장하여 생각합니다. 

첫 번째 주제는 그러지 말자는 것입니다. 그렇다면 멘탈은 사실 강해질 수 있습니다. 다시 말해, ""나는 스트레스에 약하다"", ""나는 멘탈이 약하다""는 표현 자체는 사용하지 않는 것이 맞습니다. 멘탈이 약한 첫 번째 유형은 과도한 불안입니다. 압박을 받으면 무너지는 사람들이 많고, 이를 극복하기 위해 노력합니다. 하지만 불안은 강렬한 감정이기 때문에 우리는 이를 쉽게 이길 수 없습니다. 진짜 피해야 하는 상황이 아니라면, 불안을 유발하는 것들은 가능한 피하는 것이 좋습니다. 

자극 추구 성향이 높은 사람들은 재미있는 것을 좋아하고, 호기심이 많아서 지루함을 참지 못합니다. 이런 사람들은 자극을 추구하게 되고, 이는 소비에서도 나타납니다. 소비를 억제하기보다 버는 쪽으로 움직이는 것이 낫습니다. 강박이 멘탈을 약하게 할 수도 있습니다. 강박증은 원치 않는 생각이 드는 반면, 해야 할 일이라고 느끼는 것입니다. 강박증이 있는 사람은 종종 최악의 상황을 떠올리며, 이를 극복하기 어려워합니다. 

사회적 불편감이 있는 사람들은 태어날 때부터 다른 사람과 함께 있기를 원하지 않는 경우가 있습니다. 흥미로운 것은, 이런 사람들은 주변의 기대에도 불구하고 스스로의 편안함을 위해 고군분투합니다. 하지만 혼자 있는 것이 편한 사람은 그들만의 강점을 가질 수 있습니다. 학교나 직장에서 이런 사람들은 상대적으로 더 힘들어할 수 있습니다.

충동적인 사람들은 끈기를 못 가지는 경향이 있어 자신을 멘탈이 약하다고 인식할 수 있습니다. 그러나 충동적인 성향 자체는 나쁜 게 아닙니다. 어떤 이들은 긍정적인 충동으로 인해 위험에 뛰어드는 경우도 있습니다. 역설적으로, 충동적이지 못한 사람들이 완료할 수 없는 일을 요구받고 불리한 상황에 처할 수 있습니다. 

우울증 역시 멘탈을 약하게 만들 수 있습니다. 예를 들어서, 인생에 문제가 생기면 우리의 멘탈이 쉽게 흔들릴 수 있습니다. 하지만 우울증에서 벗어나면 이후 상당히 강해질 수 있습니다. 경우에 따라 우울한 기간이 지나가면 멘탈이 강해질 가능성이 높습니다. 나아가, 성인 ADHD와 같은 문제도 마찬가지로, 소소하게 유의하고 적응하는 방법을 찾아가면 됩니다.

결론적으로 내가 잘하는 것에 집중하여 생활하며, 부정적인 생각을 피하는 것이 중요합니다. 최명기와정을 통해 내가 잘하고 싶지 않은 것에 너무 매몰되기보다 내가 잘하는 것에 가치를 두고 살아가는 것이 좋습니다."
https://www.youtube.com/watch?v=mnzC5ofzUr0,"‘이런 사람’들은 밤에 잠 안 오면 차라리 유튜브, 게임해야 합니다","대한민국 서울의 행복도는 최저입니다. 서울이 모든 행복도를 깎아먹고 있습니다. 우선, 자녀가 좋은 대학교에 진학하지 못하면 부모는 자기가 행복할 권리가 없다고 생각하게 됩니다. 자녀가 대기업이나 제대로 된 직장에 들어가지 못하면 부모는 더욱 행복할 권리를 상실하게 됩니다. 그래서 그런 부모와 함께 살면 자식도 행복할 권리가 없다고 느끼게 됩니다.

최근 한 달 동안 정신과 상담에 내원하는 환자들 가운데 가장 많은 경우는 '사는 게 힘들다', '불안하다', '잠을 못 자겠다'는 문제들입니다. 여러 가지 문제를 나누어 보면 우울증이 가장 많은 것 같습니다. 우울증은 어떤 경우에는 실제적인 스트레스 상황으로 인해 발생하기도 하고, 어떤 경우에는 원인과 결과가 서로 뒤바뀌어 생각하기도 합니다. 예를 들어, 안 좋은 일이 있어서 우울증이 찾아온 것으로 생각하는 경우 말입니다. 불안으로 내원하는 환자들 중에서도 불안이 지속되는 경향이 두 가지가 있습니다. 하나는 삶의 여러 면에서 지속적으로 불안한 상태인 분들이 있고, 다른 하나는 특정 상황에서만 불안감을 느끼는 경우입니다.

학생들은 특히 고등학교 시절에 강박증을 경험하기도 합니다. 학업에 대한 압박감이 원인인데, 이는 학생들의 학습에 큰 영향을 미칩니다. 요즘에는 발표 공포증이나 공황장애를 겪는 경우도 많습니다. 특히 45세 이상에서 최초로 공황발작이 발생한 경우, 이는 우울증에 기인한 경우가 많습니다. 치료를 받으면 약 6개월에서 1년 사이에 증세가 사라지는 경우가 많습니다. 

강박증에 시달리는 사람들은 특히 공공장소, 예를 들어 지하철에서 불안한 마음을 느낍니다. 이성에 대한 강박적인 두려움이 생기고, 걱정을 하게 되면 더욱 심한 강박 장애로 이어질 수 있습니다. 자산이 많고 적음에 관계없이 같은 유형의 정신적 어려움에 직면할 수 있습니다. 그러나 실제로 우울증이나 불안장애가 있을 경우, 자산이 없는 사람은 더 큰 위기에 처하기 쉽습니다. 반면, 자산이 많은 사람은 우울증을 겪더라도 경제적 여유로 인해 비교적 이겨낼 힘이 있을 수 있습니다.

우울증 환자들은 종종 수면 패턴에 문제가 생기고, 그런 문제로 인해 일을 할 수 있는 상황이 되지 않는 경우가 많습니다. 이로 인해 공황발작이 일어날 수 있으며, 이는 직장에서의 위치에 따라 영향을 미칠 수 있습니다. 요즘 많은 청소년들이 필요 이상으로 게임을 하거나 유튜브를 소비하며 스트레스를 해소하려는 경향이 있습니다. 하지만 이들이 행복을 느끼지 못하는 경우가 많습니다.

참고로, 서울에서의 행복도는 낮고, 경쟁이 치열한 환경에서 자아 존중감이 개별적으로 깎여지는 현상이 나타나는 것 같습니다. 주변 사람들과의 비교에서 오는 불행감은 서울이라는 대도시에서 더욱 두드러지는 상황입니다. 서울에서는 모든 것이 상대적인 기준으로 평가되고, 이로 인해 자아 가치가 낮아지는 경우가 많습니다.

또한, 대한민국의 출산율이 낮은 이유 중 하나는 높은 집값과 직장 상황입니다. 집을 마련하는 것이 결혼의 중요한 조건이 되면서, 결혼을 미루게 되고 출산율이 저하되는 것으로 보입니다. 서울은 특히 이러한 경향이 심각합니다. 여성들은 좋은 직장에서 일하며 늦게 결혼하는 경우가 많고, 이는 가족을 이루는 데 있어 부정적인 요소로 작용합니다. 

결국 서울의 높은 집값이 결혼과 출산을 더욱 어렵게 만드는 요소로 작용하고 있습니다. 이러한 뿌리 깊은 사회적 구조를 개선하지 않는 한, 출산율 회복은 어려울 것이라는 의견이 지배적입니다."
