video_url,title,summary
https://www.youtube.com/watch?v=tMfYrIBCxqs,"뇌과학으로 본 우울증 극복 방법 2가지, 당장 해보세요","제가 블로그에서 우울증에서 살아남기 시리즈를 연재한 것은 코로나가 시작되던 시기였습니다. 전 세계적인 팬데믹 때문에 모두가 충격을 받았고, 그로 인해 우울증이 심각해졌습니다. 팬데믹이 심각하든 끝나든, 우울증은 여전히 심각한 문제입니다. 게다가 우울증은 현재 여러분이 겪고 있는 모든 질환과 결합하여 상황을 더 악화시킬 수 있습니다. 여러분이 어디가 아프든 관계없이 우울증은 함께할 수 있습니다. 병원 진료에 더하기 우울증, 입시 실패에 더하기 우울증, 항암치료에 더하기 우울증, 육아에 더하기 우울증, 실직에 더하기 우울증, 파산에 더하기 우울증, 고부갈등에 더하기 우울증, 주식 폭락에 더하기 우울증, 교통사고에 더하기 우울증, 이런 식으로 고통의 정도를 훨씬 악화시킬 수 있는 강력한 조합이 바로 우울증입니다. 지구에 사는 사람 수만큼의 우울증 조합이 가능할 것입니다. 생활습관의 변화가 우울증 치료에 도움이 됩니다. 명쾌한 한의원은 약을 그다지 권하지 않습니다. 대신 마법의 약을 먹고 병을 낫게 하는 것이 진정한 치료인지 여러분께 자주 질문합니다. 명쾌한 알러지 치료는 여러분의 트라우마와 마음의 상처를 해결하기 위한 길을 제시할 것입니다. 거기에 여러분의 노력이 더해지길 바랍니다. 

여러분이 스스로 노력한다면 더욱 회복할 수 있는 포인트에 대해 제가 침묵할 수는 없습니다. 주의사항 첫 번째입니다. 가라앉는 증상을 즐기지 마세요. 누군가는 바닥에 가라앉는 것을 좋아한다고 오해할 수 있습니다. 우울증이 심각한 상황에서도, 여러분이 운동은커녕 누워 있는 상태에서 손가락조차 움직이지 못하리라는 것을 잘 알고 있습니다. 그러나 그 상태로 끝나지 않을 것입니다. 오늘도 제시간에 일어나지 못했나요? 오늘 운동하자는 계획을 지키지 못했나요? 오늘 아무 이유 없이 약속을 취소했나요? 오늘도 지각했나요? 여러분이 가라앉아 있는 동안 일어난 일들은 여러분을 다시 잡아 끌어 인생의 나락으로 더 깊이 가라앉게 합니다. ""나는 안 돼. 나는 글렀어.""와 같은 생각은 꼬리를 물고 우울감은 더욱 깊어질 것입니다. 오늘의 그 부정적인 감정은 내일을 더욱 우울하게 만들 수 있습니다. 바닥이 없고 계속 가라앉습니다. 가라앉는 우울증은 쉽게 발생합니다. 이러한 증상이 없다면 여러분은 우울증이 아닙니다. 대부분의 문제는 뇌에서 발생합니다. 여러분이 가라앉고 의욕이 없고 덜풀린 기분이 드는 것은 호르몬과 신경전달물질 및 뇌의 각 영역 간의 충돌로 인한 결과입니다. 저는 명쾌한 알러지 치료를 통해 여러분의 뇌와 호르몬, 신경전달물질의 균형을 치료하고 있습니다. 치료할 수 있습니다. 대신 여러분이 나락에 빠져 움직이고 싶지 않은 마음을 흔들어 깨우는 일에 협조해 주세요. 가라앉은 마음을 떠오르게 하는 방법을 알려드리겠습니다. 알려드리더라도 스스로 행동하는 것은 여러분의 몫입니다.

우울할 때, 뇌과학이라는 책의 '하강 나선'이라는 표현이 떠오릅니다. 이 표현이 매우 마음에 듭니다. 여러분을 잡아끌어 바닥치게 하는 것은 한 번으로 끝나지 않을 것입니다. 그냥 수직으로 떨어지지 않고, ""오늘은 나아졌나? 오늘은 좀 괜찮은가?"" 하며 다른 노선을 타다가 포기하는 동안 다시 제자리로 돌아오는 것과 같습니다. 나선형으로 소용돌이 치며 내려가는 우울증의 감정을 잘 표현하는 것 같습니다. 그래서 우울증의 악화 요인을 저도 '하강 나선'이라고 부르려 합니다.

주의사항 두 번째입니다. 자책하거나 비난하지 마세요. 우울증은 하루아침에 호전되지 않습니다. 뇌는 매우 게으릅니다. 자주 하던 대로 살아가려다 보니 현재의 정상에서 회복되기가 쉽지 않습니다. 그러나 우리는 명쾌한 알러지 치료를 진행하고 있거나 할 예정입니다. 우울증 치료는 제가 알아서 할 것이며, 우울증은 반드시 좋게 변화할 것입니다. 오늘의 영상은 빠른 치료를 위해 여러분이 스스로 할 수 있는 작은 실천을 찾아보라는 메시지입니다. 여러분의 우울증이 심각하다면 오늘도 원하는 대로 내 몸이 움직이지 않는 것이 당연합니다. 자기를 비난하거나 자책하지 마세요. 원래 뇌의 생활 패턴이 그러니까 당연히 생각하고 시작합시다. 대신에 아주 소소한 실천, 너무 사소해서 뇌가 별것 아닌 것으로 여길 만한 작은 실천을 조금 해보는 것만 약속합시다. 오늘은 우울증 하강 나선에서 벗어나기 위한 두 가지 주의사항을 소개해 드렸습니다. 우울증에서 살아남기 위한 영상은 계속해서 제작할 예정입니다. 어려운 마음의 문제가 있으시면 언제든지 문의해 주세요. 우울증을 이겨내기 위한 실천 방법과 새로운 습관 만들기에 대한 이야기를 다시 가져오겠습니다."
https://www.youtube.com/watch?v=tLlWWlLkKmk,'난 왜 이럴까?' 우울증을 악화시키는 자기 비하를 극복하는 방법 (생활 속 우울증 탈출 노하우 2가지),"우울증에서 살아남기 

나는 도대체 왜 이럴까? 왜 생각대로 내 몸을 움직일 수 없을까? 왜 제 시간에 일어나지 못할까? 알람이 들려도 왜 나는 일어나지 못할까? 나는 왜 계획을 세워도 계획대로 실천하지 못할까? 왜 나는 약속시간에 언제나 늦을까? 왜 나는 하고 싶은 마음이 들지 않을까? 왜 다른 사람들은 다 잘하는 것 같은데 나는 언제나 하다 말고 중간에 포기할까? 왜 나는 희망이 없을까? 왜 나는 열심히 해도 잘 안 될까? 왜 나는 의지력이 이렇게 부족할까? 나는 왜 침대 밖으로 나가지 못할까? 나는 뭐가 문제일까? 오늘은 제가 우울증 치료에 시너지를 내는 법을 알려드립니다. 스스로 감정의 바닥을 치고 상승하는 것을 연습하는 셈입니다.

첫 번째 미션입니다. 자기 비하를 멈추세요. 끝도 없이 자기를 탓하며 비난하고 있다면 마음을 강하게 먹어도 별 효과가 없는 게 당연합니다. 대뇌의 인식적인 명령보다 무의식적인 호르몬의 반응이 빠르기 때문입니다. 이미 호르몬이 분비된 후에는 여러분의 의지로 그 상황을 바꿀 수 없습니다. 만약에 여러분이 자기를 비난하고 있다면 그런 감정이 호르몬을 자극해서 더 우울감을 심하게 만드는 중입니다. 그런데 그 와중에 의지력으로 여러분의 행동을 바꾸려고 하면 계란으로 바위를 치는 듯한 기분이 들 것입니다. 

예를 들어 여러분의 눈이 나쁘다고 칩시다. 그런데 강한 의지로 마음을 다잡습니다. 나는 눈이 잘 보일 수 있어. 내가 마음을 강하게 먹으면 눈이 잘 보일 거야. 그렇게 노력해도 눈이 좋아지지 않으니까 자기 의지력이 약하다고 탓을 합니다. 우울증에 빠진 여러분의 문제가 그와 같습니다. 우울증은 의지력이 약한 문제가 아닌 것입니다. 정신력을 탓하기 전에 시력이 그 정도 나올 수밖에 없는 구조적인 문제를 해결해야 합니다. 뇌에서 우울감을 심화시키고 무기력하게 만드는 방향으로 호르몬과 신경전달물질이 배출되고 뇌의 각 영역이 조화롭게 작동하지 못하는 시스템 자체를 손대야 합니다. 

우리의 감정을 조절하는 신경전달물질이 있습니다. 저는 그런 신경전달물질의 불균형으로 나타나는 현상을 '알러지'라고 표현하는데요. 세로토닌 알러지는 우울감, 무기력감, 의욕부진, 불안감, 자괴감과 연관이 있습니다. 평정심과 침착함이 사라지고 충동적으로 변합니다. 가짜 알러지는 우울감, 불안감, 자괴감, 분노, 이상식욕, 이상성욕과 연관이 있습니다. 술, 담배, 마약, 도박에 쉽게 중독되게 만듭니다. 아드레날린 알러지는 공격성, 분노, 불안감, 부정적 성격, 주의력 결핍, 과잉행동과 연관이 있습니다. 스트레스에 민감한 체질로 만들고요. 코르티솔은 우울감, 만성피로, 의욕부진, 정서불안, 폭식증과 연관됩니다. 우울증은 이런 신경전달물질의 불균형의 결과입니다. 그래서 기울어진 방향으로 공이 구르듯 여러분의 마음은 우울한 방향으로 굴러가도록 이미 세팅이 되어 있습니다. 

그러면 뇌가 그렇게 우울하도록 세팅되어 있다면 그럼 영원히 그냥 그렇게 우울하게 살아야 된다는 얘기를 하는 걸까요? 아닙니다. 우울하게 기울어진 뇌 반응의 패턴을 평평하게 바꿔주는 방식으로 여러분의 생각을 써먹어야 합니다. 

오늘의 두 번째 미션입니다. 알아차리는 것입니다. 감정은 쏙 뺍니다. 그냥 무미건조한 사실만 알아차리는 연습을 합니다. 남들이 볼 때 내가 우울할 만해서 우울한 게 아니고 그저 내 뇌가 우울하고 싶어해서 이런 일이 벌어졌다는 사실을 알아차려야 합니다. 편도체는 예측 불가능한 상황에서 우리를 지키기 위해 불안감을 높여서 경고합니다. 그런데 시도 때도 없이 올라오는 부정적인 생각은 우울증을 악화시키고, 우울감이 심할수록 더 부정적으로 살게 됩니다. 내려가는 에스컬레이터에 올라탄 겁니다. 이럴 때는 내가 현재 벌어지는 상황을 잘 알고 있다고 생각하는 것만으로도 편도체의 과잉 흥분이 진정됩니다. 

우울해서 울고 싶고 그냥 누워있고 싶은데 가만히 보니까 아무 일이 없는 걸? 우울할 만한 특별한 이유는 없네? 이런 것을 뇌의 성향이라고 할 수 있습니다. 그냥 내 뇌가 오늘 울고 싶다는 것인데? 이렇게 생각하면서 관찰하는 것이 필요합니다. 지금 이렇게 인정하는 것 자체가 지금까지 하지 않던 행동입니다. 이것 자체가 하강 나선에서 탈출하는 비결입니다. 

우울하게 기울어진 뇌가 점차 평평하게 돌아오기 시작합니다. 그러나 한 번의 생각으로 우울증이 다 나을까요? 그런 마음은 마치 하루 공부하고 서울대 가고 싶어 하고, 한 시간 운동하고 바디프로필을 찍겠다는 것과 비슷합니다. 뇌는 아주 효율적인 기관이라서 하던 방식을 고수하려고 합니다. 우울한 방식으로 뇌에 길이 나 있는데 무슨 새로운 길을 내겠습니까? 

그래서 연습해도 하루 만에 여러분의 감정이 잘 돌아오지는 않을 겁니다. 그게 당연합니다. 계속 과거 상태로 돌아가고, 노력해도 별 변화가 없어 보일 것입니다. 그냥 그런가 보다 합시다. 새로운 방향으로 반복해서 걷다보면 예전에 다니던 그 길에 풀이 나서 덮여 서서히 보이지 않게 될 것입니다. 

혼자서는 못한다고 하겠죠. 이미 알고 있습니다. 그냥 한 번 부담 없이 시도해보세요. 제가 돕고 있으니까요. 우울증이 심한 분들께는 힘내라는 말도 상처가 되기도 합니다. 너무 극심한 분들은 명쾌한 체원장의 셀프 감정 치료를 활용해보세요. 

우울증에서 살아남기 다음 시간에 또 찾아오겠습니다."
https://www.youtube.com/watch?v=k36Oa1Dptu8,작심삼일도 병인가... 우울증 · 무기력 · 번아웃 · 의욕상실 탈출하는 법,"명쾌한 최원장이 ""뇌의 우울한 길 말고 새로운 길을 내자""고 했습니다. 생각의 방식을 바꾸는 법을 말씀드렸죠. 그런데 사실 그것보다 더 빠른 방법이 있습니다. 그것이 뭐냐면 바로 행하는 것입니다. 뭘 행하는 것이냐고요? 아무거나 다요. 좌절하지 말고 자학하지 말고 멈추지도 말고 뭐라도 하는 것입니다. 커튼을 열고 창문을 여는 것도 가능합니다. 운동화를 신고 밖에 나갈 수도 있습니다. 설거지를 하거나 책상을 정리할 수도 있습니다. 책을 읽거나 글을 쓸 수도 있습니다. 하다못해 물을 한 잔 마시는 것도 우울증의 하강 나선에서 탈출하는 뇌의 새로운 길을 내는 도전입니다. 침대에서 몸을 일으켜서 하는 일이라면 무엇이든지 다 됩니다.

그런데 제가 우울증에서 살아남기 전략이라면서 이렇게 말하면 여러분은 기분이 이상할 수 있습니다. ""아무 소용없어, 저게 전략이라고? 물 한 잔 마시는데 마음이 변해? 웃기지 마. 나는 지금까지 아무것도 한 게 없어. 된 것도 없어. 나는 능력이 없고 소질도 없고 운도 없어. 살고 싶지 않아. 이러다 죽어버릴래. 아무도 나에게 관심이 없어. 하고 싶지 않아. 힘이 없어. 몸이 무거워. 천근 만근이야."" 이렇게 뇌는 또 아래로 끌어당깁니다. 명쾌한 최 원장에게 댓글은 못 달고 속으로 말씀하십니다. ""나는 그래도 아무것도 하고 싶지 않아. 하고 싶은 마음이 생기게 만들어 봐. 하고 싶은 마음이 들면 그때 시작하겠어."" 이렇게 마음이 힘드신 분들이 하고 싶지 않은 걸 잘 알겠습니다. 

그런데 제가 예언을 하나 할게요. 시작하고 싶은 순간은 영혼이 오지 않습니다. 의욕은 스스로 생기지 않아요. 마음은 마치 시골집 마당에 있는 옛날 펌프와 비슷합니다. 이런 거 보신 적 있으세요? 지금 물이 필요하니까 펌프질을 하는 것입니다. 펌프가 물을 끌어올리는 기계잖아요. 그런데 아무리 펌프질을 해도 물이 나오지 않네요. 고장난 줄 알았는데 알고 보니 마중물을 안 넣어서 그렇답니다. ""아니 뭐라고요? 펌프에 물을 넣으라고요?"" 물이 필요해서 펌프질을 하는 것이거든요. 물을 넣어야 될 것 같으면 펌프질을 왜 하겠어요? 과학적 원리는 그렇습니다. 물을 끌어올리기 위해서는 마중물을 부어줘야 하는 것처럼, 의욕이 나지 않으니 하고 싶은 마음이 들기 위해서라도 빨리 뭐라도 시작해야 합니다. 의욕이 생기길 기다리지 마시고 그냥 아무거나 시작하세요.

너무너무 하기 싫었는데 일단 하다 보니 뭐라도 되던 경험이 없으신가요? 운동을 하긴 해야 되는데 너무 귀찮고 몸이 천근 만근이라 정말로 움직이기 싫었는데, 움직이다 보니 그냥 저냥 할만하게 되고 그래서 내 생각보다 더 많이 움직이게 되던 그런 경험이 없으신가요? 억지로 몸을 움직였지만 그렇게 움직이고 나니 오히려 기분이 뿌듯하고 상쾌해지던 기억이 있지 않습니까? 어떤 일을 시작했을 때 마음이 점점 고조되어 정말로 의욕이 생기는 현상을 심리학자 에밀 크레펠리는 자극 흥분이라고 정의했습니다. ""시작이 반이다""라고도 했고요. 하면 할수록 더 잘되고 하는 사람이 더 누리게 됩니다.

의욕에 관여하는 것은 뇌의 측좌핵입니다. 뇌의 좌우에 신경이 모여있는 측좌핵은 무슨 일이든지 시작하면 반응이 나타납니다. 측좌핵이 작동하면 무언가에 몰두하고 집중하게 됩니다. 동기가 생기고 보상을 기대하게 됩니다. ""속제를 빨리 해버릴래, 그러면 엄마가 좋아할 거야"" 생각했는데 ""아, 당이 땡긴다. 아이스크림이 먹고 싶다. 속제를 빨리 다 하고 나서 아이스크림 사달라고 할까?"" 이렇게 마음이 더 적극적으로 변하게 됩니다. 

일단 측좌핵이 작동하면 동기가 생기고 보상심리가 작동합니다. 그런데 문제가 있어요. 측좌핵이 스스로 먼저 작동하지는 않아요. 어느 정도 자극이 주어졌을 때에만 그제서야 측좌핵이 작동하고 흥분하는 것이 문제입니다. ""누가 날 공부 좀 하고 싶게 만들어 봐. 하고 싶지 않은데 어떻게 공부를 억지로 하지?"" 사실 우리 모두 이런 상태입니다. ""지금은 하기 싫어, 귀찮아. 시간 지나면 어떻게 되겠지. 공부하고 싶을 때 하면 되지."" 우리는 모든 일을 이런 식으로 미루며 살죠. 

이렇게 내가 의욕이 생기는 순간을 기다리는 동안 내 뇌의 측좌핵도 마냥 기다리고만 있습니다. ""나보고 어쩌라고? 누가 나를 자극해줘야지. 작동 명령을 해줘야지. 스위치를 안 눌러주는데 내가 먼저 뭘 어떻게 해?"" 서로의 자극을 영원히 기다리실 건가요? 억지로라도 시작하세요. 일단 천리길도 한 걸음부터. 투덜투덜하며 시작했더라도 일을 시작하면 그것이 측좌핵에 자극으로 전달되고 아세틸콜린이 분비됩니다. 점점 기분이 좋아지고 흥분하고 일의 속도가 붙고 능력이 좋아집니다. 그래서 의욕이 나지 않아도 그냥 일단 시작하고 보라는 이야기입니다. 

자, 여기까지는 인터넷을 찾아보면 찾을 수 있는 이야기입니다. 그런데 알레르기가 심한 분들 중에는 뇌 영역의 작동이 불안정한 분들이 있습니다. 교과서적인 반응이 나타나지 않아요. 뇌와 신경전달물질, 호르몬과 협력해서 몸의 작용을 조율하는 반응이 어딘가 막혀 있고 꼬여 있고 기능이 저하되어 뭔가 불편하고 이상하고 아픕니다. 그런 경우에 알레르지 검사를 해보면 브레인 믹스, 뇌 영역, 그랜듈라, 신경전달물질 호르몬에서 알레르기 양성 반응이 나타납니다. 뇌와 신경전달물질, 특정 호르몬 등이 작동하는 과정에서 기어의 충돌이 몸의 불편감을 일으킵니다. 저는 그것에 대해 검사하고 치료할 수 있습니다. 측좌핵은 브레인 믹스 바이알의 하부 영역입니다. 일반적으로 우울증 수준을 벗어난 심각한 뇌신경계 질환이 아니라면 브레인 믹스 치료로 안정화를 시켜주는 것 정도로도 우울감을 비롯한 마음의 문제는 비교적 쉽게 안정을 찾을 수 있습니다. 

그래서 자폐 스펙트럼 장애, 조현병, 알츠하이머 등 알레르기로 유발되는 심각한 뇌질환을 치료하고 있는 입장에서는 우울증은 치료할 수 있습니다. 치료가 잘 됩니다. 그러니까 걱정하지 마시고요. 제가 막 “Just Do It” 이렇게 가혹하게 밀어붙이지 않습니다. 목표치를 낮춰도 됩니다. 그리고 자기 감정을 말하고 싶어 애쓰는 몸의 표현을 들어주기만 해도 됩니다. ""그래, 하고 싶지 않은 거 잘 알겠어. 하는 척만 해보자."" 처음에는 이렇게 시작해도 좋습니다. 척만 해도 됩니다. 그래도 변하기 시작합니다.

안 된다고요? 물론 한 번에 잘 되는 게 어디 있겠습니까? 여러 번 시도하고 계속 시도하고 노력이 필요합니다. 그런데 지금 느낌이 딱 오는 사람이 있습니다. ""나는 이런 걸로 안 되는구나. 치료가 필요할 정도의 질환 수준이구나."" 오늘 영상을 보시면서 그런 게 느껴진다면 저를 찾아오세요. 알레르지 치료로 뇌의 에너지 불균형을 잡아줄 수 있습니다. 아무리 그래도 치료를 받고 있는 저라도 오늘 말씀드린 것은 여러분의 회복에 도움이 됩니다. 제가 여러분의 우울증을 타파시켜 드리겠습니다."
